Symbol,Name,Last Sale,Net Change,% Change,Market Cap,Country,IPO Year,Volume,Sector,Industry
QH,Quhuo Limited American Depository Shares,$1.46,-0.08,-5.195%,9004727.00,China,2020,53349,Consumer Discretionary,Business Services
QIPT,Quipt Home Medical Corp. Common Shares,$5.90,-0.10,-1.667%,207913115.00,United States,,30615,,
QLGN,Qualigen Therapeutics Inc. Common Stock,$1.27,0.03,2.419%,5347636.00,United States,2015,49422,Health Care,Biotechnology: Commercial Physical & Biological Resarch
QLI,Qilian International Holding Group Ltd. Ordinary Shares,$1.35,0.00,0.00%,48262500.00,China,2021,8297,Health Care,Biotechnology: Pharmaceutical Preparations
QLYS,Qualys Inc. Common Stock,$113.63,2.59,2.332%,4316579735.00,United States,2012,241087,Technology,EDP Services
QMCO,Quantum Corporation Common Stock,$1.59,0.02,1.274%,165105603.00,United States,,32460,Technology,Electronic Components
QNCX,Quince Therapeutics Inc. Common Stock,$0.808,0.018,2.278%,29193287.00,United States,2019,70059,Health Care,Biotechnology: Biological Products (No Diagnostic Substances)
QNRX,Quoin Pharmaceuticals Ltd. American Depositary Shares,$1.52,0.02,1.333%,7366838.00,Israel,2016,29562,Health Care,Medical/Dental Instruments
QNST,QuinStreet Inc. Common Stock,$14.91,0.12,0.811%,799777589.00,United States,2010,287633,Consumer Discretionary,Advertising
QOMO,Qomolangma Acquisition Corp. Common Stock,$10.12,0.02,0.198%,66666745.00,United States,2022,20000,Industrials,Consumer Electronics/Appliances
QOMOR,Qomolangma Acquisition Corp. Right,$0.11,0.00,0.00%,0.00,United States,2022,20,,
QOMOU,Qomolangma Acquisition Corp. Unit,$10.22,0.03,0.294%,0.00,United States,2022,100,Industrials,Consumer Electronics/Appliances
QQQX,Nuveen NASDAQ 100 Dynamic Overwrite Fund Shares of Beneficial Interest,$22.62,0.21,0.937%,1063577493.00,United States,,127550,Finance,Finance Companies
QRHC,Quest Resource Holding Corporation Common Stock,$6.54,0.14,2.188%,129201042.00,United States,,88070,Consumer Discretionary,Building Products
QRTEA,Qurate Retail Inc. Series A Common Stock ,$2.58,0.31,13.656%,986106031.00,United States,,14905075,Consumer Discretionary,Catalog/Specialty Distribution
QRTEB,Qurate Retail Inc. Series B Common Stock ,$6.58,1.5457,30.703%,2514952591.00,United States,,306828,Consumer Discretionary,Catalog/Specialty Distribution
QRTEP,Qurate Retail Inc. 8.0% Fixed Rate Cumulative Redeemable Preferred Stock,$45.43,3.75,8.997%,0.00,United States,,202372,Consumer Discretionary,Catalog/Specialty Distribution
QRVO,Qorvo Inc. Common Stock,$112.53,2.42,2.198%,11409357397.00,United States,,1275297,Industrials,Industrial Machinery/Components
QSG,QuantaSing Group Limited American Depositary Shares,$12.56,0.04,0.319%,0.00,China,2023,166988,,
QSI,Quantum-Si Incorporated Class A Common Stock,$2.22,-0.06,-2.632%,310398169.00,United States,2020,510694,Health Care,Biotechnology: Pharmaceutical Preparations
QSIAW,Quantum-Si Incorporated Warrant,$0.501,0.0009,0.18%,0.00,United States,2020,1161,Health Care,Biotechnology: Pharmaceutical Preparations
QTEK,QualTek Services Inc. Class A Common Stock,$0.5521,-0.0101,-1.797%,15351504.00,United States,2021,40350,Consumer Discretionary,Telecommunications Equipment
QTEKW,QualTek Services Inc. Warrant,$0.0351,-0.0089,-20.227%,0.00,United States,2021,1225,Consumer Discretionary,Telecommunications Equipment
QTRX,Quanterix Corporation Common Stock,$14.46,-0.06,-0.413%,535811034.00,United States,2017,113812,Health Care,Industrial Specialties
QTT,Qutoutiao Inc. American Depositary Shares,$0.85,-0.004,-0.468%,24621392.00,China,2018,33332,Technology,Computer Software: Prepackaged Software
QUBT,Quantum Computing Inc. Common Stock,$1.84,-0.06,-3.158%,98075321.00,United States,,82241,Technology,Computer Manufacturing
QUIK,QuickLogic Corporation Common Stock,$6.03,0.00,0.00%,79068616.00,United States,1999,2768,Technology,Semiconductors
QUMU,Qumu Corporation Common Stock,$0.8909,0.0007,0.079%,15976337.00,United States,,71547,Technology,Retail: Computer Software & Peripheral Equipment
QURE,uniQure N.V. Ordinary Shares,$21.39,-0.21,-0.972%,1001375182.00,Netherlands,2014,300591,Health Care,Biotechnology: Pharmaceutical Preparations
RADI,Radius Global Infrastructure Inc. Class A Common Stock,$13.15,0.19,1.466%,1252978853.00,United States,,1821709,Consumer Discretionary,Telecommunications Equipment
RAIL,FreightCar America Inc. Common Stock,$3.36,-0.02,-0.592%,57870308.00,United States,2005,14927,Industrials,Railroads
RAIN,Rain Oncology Inc. Common Stock,$10.00,0.49,5.152%,351411560.00,United States,2021,262592,Health Care,Biotechnology: Pharmaceutical Preparations
RAM,Aries I Acquisition Corporation Class A Ordinary Share,$10.38,0.01,0.096%,61136207.00,Cayman Islands,2021,21031,Finance,Business Services
RAMMU,Aries I Acquisition Corporation Unit,$10.40,0.01,0.096%,0.00,Cayman Islands,2021,600,Finance,Business Services
RAMMW,Aries I Acquisition Corporation Warrant,$0.05,-0.0001,-0.20%,0.00,Cayman Islands,2021,2332,Finance,Business Services
RAND,Rand Capital Corporation Common Stock,$13.96,0.2899,2.121%,36031053.00,United States,,288,Finance,Finance/Investors Services
RANI,Rani Therapeutics Holdings Inc. Class A Common Stock,$5.83,-0.07,-1.186%,294667083.00,United States,2021,12944,Health Care, Medicinal Chemicals and Botanical Products 
RAPT,RAPT Therapeutics Inc. Common Stock,$27.45,-0.51,-1.824%,932336697.00,United States,2019,702710,Health Care,Biotechnology: Pharmaceutical Preparations
RARE,Ultragenyx Pharmaceutical Inc. Common Stock,$44.14,0.74,1.705%,3094463568.00,United States,2014,623432,Health Care,Biotechnology: Pharmaceutical Preparations
RAVE,Rave Restaurant Group Inc. Common Stock,$1.70,-0.02,-1.163%,31699263.00,United States,,25427,Consumer Discretionary,Restaurants
RAYA,Erayak Power Solution Group Inc. Class A Ordinary Shares,$2.49,-0.01,-0.40%,29880000.00,China,2022,39408,,
RBB,RBB Bancorp Common Stock,$20.26,0.425,2.143%,384246622.00,United States,2017,35751,Finance,Commercial Banks
RBBN,Ribbon Communications Inc. Common Stock,$3.50,0.04,1.156%,588430756.00,United States,,391578,Technology,EDP Services
RBCAA,Republic Bancorp Inc. Class A Common Stock,$42.80,0.22,0.517%,845164538.00,United States,1998,5568,Finance,Major Banks
RBKB,Rhinebeck Bancorp Inc. Common Stock,$9.35,0.00,0.00%,105510683.00,United States,2019,102,Finance,Major Banks
RCAC,Revelstone Capital Acquisition Corp. Class A Common Stock,$10.13,0.00,0.00%,208931250.00,United States,2022,4,Industrials,Consumer Electronics/Appliances
RCAT,Red Cat Holdings Inc. Common Stock,$1.23,0.03,2.50%,66810793.00,United States,,366978,Industrials,Wholesale Distributors
RCEL,Avita Medical Inc. Common Stock,$8.69,0.07,0.812%,217518538.00,United States,,70976,Health Care,Medical Specialities
RCII,Rent-A-Center Inc. Common Stock,$25.62,0.22,0.866%,1426266630.00,United States,1995,233379,Consumer Discretionary,Diversified Commercial Services
RCKT,Rocket Pharmaceuticals Inc. Common Stock,$22.39,-0.21,-0.929%,1762742758.00,United States,2015,566197,Health Care,Biotechnology: Pharmaceutical Preparations
RCKY,Rocky Brands Inc. Common Stock,$29.84,0.08,0.269%,218620104.00,United States,1993,22723,Consumer Discretionary,Shoe Manufacturing
RCLF,Rosecliff Acquisition Corp I Class A Common Stock,$10.10,0.00,0.00%,319412500.00,United States,2021,20,Industrials,Consumer Electronics/Appliances
RCLFU,Rosecliff Acquisition Corp I Unit,$10.1241,0.0101,0.10%,0.00,United States,2021,2760,Industrials,Consumer Electronics/Appliances
RCM,R1 RCM Inc. Common Stock,$13.81,0.16,1.172%,5752014949.00,United States,,2616365,Consumer Discretionary,Other Consumer Services
RCMT,RCM Technologies Inc. Common Stock,$13.33,0.08,0.604%,131190714.00,United States,,33763,Industrials,Consumer Electronics/Appliances
RCON,Recon Technology Ltd. Class A Ordinary Shares,$1.80,0.13,7.784%,12965098.00,China,2009,848133,Energy,Oilfield Services/Equipment
RCRT,Recruiter.com Group Inc. Common Stock,$0.48,0.0073,1.544%,7813327.00,United States,,31918,Technology,Interactive Media
RDCM,Radcom Ltd. Ordinary Shares,$10.80,-0.04,-0.369%,156446532.00,Israel,1997,28002,Technology,Computer peripheral equipment
RDFN,Redfin Corporation Common Stock,$6.08,0.425,7.515%,661192205.00,United States,2017,5849355,Finance,Real Estate
RDHL,Redhill Biopharma Ltd. American Depositary Shares,$0.1841,0.0046,2.563%,16790662.00,Israel,,7652179,Health Care,Biotechnology: Pharmaceutical Preparations
RDI,Reading International Inc Class A Common Stock,$3.51,0.02,0.573%,77373822.00,United States,,10245,Consumer Discretionary,Movies/Entertainment
RDIB,Reading International Inc Class B Common Stock,$19.50,1.10,5.978%,429854568.00,United States,,3760,Consumer Discretionary,Movies/Entertainment
RDNT,RadNet Inc. Common Stock,$20.39,-0.18,-0.875%,1169587732.00,United States,,68262,Health Care,Medical Specialities
RDVT,Red Violet Inc. Common Stock ,$23.76,-0.68,-2.782%,330116759.00,United States,,13490,Technology,Computer Software: Prepackaged Software
RDWR,Radware Ltd. Ordinary Shares,$21.21,0.22,1.048%,951072710.00,Israel,1999,74124,Consumer Discretionary,Business Services
REAL,The RealReal Inc. Common Stock,$1.59,0.12,8.163%,155924590.00,United States,2019,3449562,Consumer Discretionary,Consumer Specialties
REAX,The Real Brokerage Inc. Common Shares,$1.35,0.05,3.846%,241449980.00,Canada,,94978,,
REBN,Reborn Coffee Inc. Common Stock,$1.10,-0.04,-3.509%,14431475.00,United States,2022,20856,Consumer Discretionary,Restaurants
REE,REE Automotive Ltd. Class A Ordinary Shares,$0.4902,-0.0271,-5.239%,119486535.00,Israel,,370044,Consumer Discretionary,Auto Manufacturing
REED,Reeds Inc. Common Stock,$0.0749,-0.0174,-18.852%,9440386.00,United States,,2951939,Consumer Staples,Beverages (Production/Distribution)
REFI,Chicago Atlantic Real Estate Finance Inc. Common Stock,$15.47,-0.02,-0.129%,273167914.00,United States,2021,38737,Real Estate,Real Estate Investment Trusts
REFR,Research Frontiers Incorporated Common Stock,$2.085,0.045,2.206%,69118576.00,United States,,8029,Technology,Industrial Machinery/Components
REG,Regency Centers Corporation Common Stock,$66.05,0.11,0.167%,11302655656.00,United States,1993,792261,Real Estate,Real Estate Investment Trusts
REGN,Regeneron Pharmaceuticals Inc. Common Stock,$742.30,1.12,0.151%,80837906351.00,United States,1991,346397,Health Care,Biotechnology: Pharmaceutical Preparations
REKR,Rekor Systems Inc. Common Stock,$1.67,-0.03,-1.765%,90760410.00,United States,,254330,Technology,EDP Services
RELI,Reliance Global Group Inc. Common Stock,$0.65,-0.002,-0.307%,11735405.00,United States,,148009,Finance,Specialty Insurers
RELIW,Reliance Global Group Inc. Series A Warrants,$0.1625,0.06,58.537%,0.00,United States,,5812,Finance,Specialty Insurers
RELL,Richardson Electronics Ltd. Common Stock,$23.13,-0.67,-2.815%,325547441.00,United States,1983,178580,Technology,Electronic Components
RELY,Remitly Global Inc. Common Stock,$12.37,0.16,1.31%,2111111243.00,United States,2021,815240,Technology,Computer Software: Prepackaged Software
RENE,Cartesian Growth Corporation II Class A Ordinary Shares,$10.33,-0.02,-0.193%,296987500.00,United States,2022,4414,Finance,Business Services
RENEU,Cartesian Growth Corporation II Unit,$10.27,-0.07,-0.677%,0.00,United States,2022,100,Finance,Business Services
RENEW,Cartesian Growth Corporation II Warrant,$0.111,0.0025,2.304%,0.00,United States,2022,4049,Finance,Business Services
RENT,Rent the Runway Inc. Class A Common Stock,$3.90,0.17,4.558%,253588869.00,United States,2021,710241,Consumer Discretionary,Department/Specialty Retail Stores
REPL,Replimune Group Inc. Common Stock,$26.13,-1.87,-6.679%,1440126024.00,United States,2018,613667,Health Care,Biotechnology: Pharmaceutical Preparations
RETA,Reata Pharmaceuticals Inc. Class A Common Stock,$40.86,-0.75,-1.802%,1497259743.00,United States,2016,1035455,Health Care,Biotechnology: Pharmaceutical Preparations
RETO,ReTo Eco-Solutions Inc. Common Shares,$0.465,-0.0151,-3.145%,20045272.00,China,2017,43012,Consumer Discretionary,Multi-Sector Companies
REUN,Reunion Neuroscience Inc. Common Shares,$1.38,0.0101,0.737%,16068855.00,Canada,,32486,Health Care,Pharmaceuticals and Biotechnology
REVB,Revelation Biosciences Inc. Common Stock,$0.2845,0.0275,10.70%,6696012.00,United States,2020,3958731,Health Care,Biotechnology: Pharmaceutical Preparations
REVBW,Revelation Biosciences Inc. Warrant,$0.0235,0.004,20.513%,0.00,United States,2020,129069,Health Care,Biotechnology: Pharmaceutical Preparations
REVE,Alpine Acquisition Corporation Common Stock,$10.51,0.01,0.095%,142673250.00,United States,2021,203826,Industrials,Consumer Electronics/Appliances
REYN,Reynolds Consumer Products Inc. Common Stock,$29.29,-0.04,-0.136%,6146877253.00,United States,2020,256547,Industrials,Office Equipment/Supplies/Services
RFAC,RF Acquisition Corp. Class A Common Stock,$10.17,0.00,0.00%,148227750.00,Singapore,2022,1,Industrials,Consumer Electronics/Appliances
RFACU,RF Acquisition Corp. Unit,$10.24,0.01,0.098%,0.00,Singapore,2022,24900,Industrials,Consumer Electronics/Appliances
RFIL,RF Industries Ltd. Common Stock,$5.32,-0.02,-0.375%,53511598.00,United States,,4889,Technology,Electrical Products
RGC,Regencell Bioscience Holdings Limited Ordinary Shares,$29.99,-0.01,-0.033%,390255851.00,Hong Kong,2021,633,Health Care, Medicinal Chemicals and Botanical Products 
RGCO,RGC Resources Inc. Common Stock,$22.93,0.15,0.658%,225452575.00,United States,,21743,Utilities,Oil & Gas Production
RGEN,Repligen Corporation Common Stock,$193.04,11.22,6.171%,10718437705.00,United States,1986,484135,Health Care,Medical/Dental Instruments
RGF,The Real Good Food Company Inc. Class A Common Stock,$5.92,-0.08,-1.333%,152425591.00,United States,2021,6923,Consumer Discretionary,Food Distributors
RGLD,Royal Gold Inc. Common Stock,$129.72,-1.71,-1.301%,8515302061.00,United States,,391713,Industrials,Consumer Electronics/Appliances
RGLS,Regulus Therapeutics Inc. Common Stock,$1.53,0.03,2.00%,25765599.00,United States,2012,56265,Health Care,Biotechnology: Pharmaceutical Preparations
RGNX,REGENXBIO Inc. Common Stock,$23.00,-0.09,-0.39%,995753513.00,United States,2015,219459,Health Care,Biotechnology: Biological Products (No Diagnostic Substances)
RGP,Resources Connection Inc. Common Stock,$16.93,0.13,0.774%,569428310.00,United States,,120983,Consumer Discretionary,Business Services
RGTI,Rigetti Computing Inc. Common Stock,$0.8087,-0.0412,-4.848%,99494405.00,United States,,502843,Technology,Retail: Computer Software & Peripheral Equipment
RGTIW,Rigetti Computing Inc. Warrants,$0.0895,-0.0005,-0.556%,0.00,United States,,49651,Technology,Retail: Computer Software & Peripheral Equipment
RIBT,RiceBran Technologies Common Stock,$0.9999,0.0199,2.031%,6241453.00,United States,,17780,Consumer Staples,Specialty Foods
RICK,RCI Hospitality Holdings Inc. Common Stock,$93.42,-0.69,-0.733%,862287620.00,United States,1995,49708,Consumer Discretionary,Restaurants
RIDE,Lordstown Motors Corp. Class A Common Stock,$1.20,-0.02,-1.639%,275872223.00,United States,2019,4367072,Consumer Discretionary,Construction/Ag Equipment/Trucks
RIGL,Rigel Pharmaceuticals Inc. Common Stock,$1.87,-0.04,-2.094%,323203948.00,United States,2000,2050741,Health Care,Biotechnology: Pharmaceutical Preparations
RILY,B. Riley Financial Inc. Common Stock,$44.62,1.28,2.953%,1269313395.00,United States,,178559,Finance,Investment Managers
RILYG,B. Riley Financial Inc. 5.00% Senior Notes due 2026,$22.00,0.10,0.457%,0.00,United States,,3832,Consumer Discretionary,Business Services
RILYK,B. Riley Financial Inc. 5.50% Senior Notes Due 2026,$22.87,-0.04,-0.175%,0.00,United States,,2693,Consumer Discretionary,Business Services
RILYL,B. Riley Financial Inc. Depositary Shares each representing 1/1000th in a share of 7.375% Series B Cumulative Perpetual Preferred Stock par value $0.0001,$24.90,0.04,0.161%,0.00,United States,,1701,Finance,Investment Managers
RILYM,B. Riley Financial Inc. 6.375% Senior Notes due 2025,$24.00,0.1358,0.569%,0.00,United States,,16191,Consumer Discretionary,Business Services
RILYN,B. Riley Financial Inc. 6.50% Senior Notes Due 2026,$23.30,-0.20,-0.851%,0.00,United States,,21547,Consumer Discretionary,Business Services
RILYO,B. Riley Financial Inc. 6.75% Senior Notes due 2024,$24.90,0.15,0.606%,0.00,United States,,11648,Consumer Discretionary,Business Services
RILYP,B. Riley Financial Inc. Depositary Shares each representing a 1/1000th fractional interest in a share of Series A Cumulative Perpetual Preferred Stock,$21.99,-0.19,-0.857%,0.00,United States,,1435,Finance,Investment Managers
RILYT,B. Riley Financial Inc. 6.00% Senior Notes Due 2028,$22.1019,-0.3081,-1.375%,0.00,United States,,7133,Consumer Discretionary,Business Services
RILYZ,B. Riley Financial Inc. 5.25% Senior Notes due 2028,$20.90,0.053,0.254%,0.00,United States,,25456,Consumer Discretionary,Business Services
RIOT,Riot Platforms Inc. Common Stock ,$6.13,-0.10,-1.605%,1025530064.00,United States,,11456591,Technology,Retail: Computer Software & Peripheral Equipment
RIVN,Rivian Automotive Inc. Class A Common Stock,$18.31,-0.38,-2.033%,16862700790.00,United States,2021,32238976,Consumer Discretionary,Auto Manufacturing
RKDA,Arcadia Biosciences Inc. Common Stock,$0.3204,-0.0206,-6.041%,7895604.00,United States,2015,155267,Industrials,Agricultural Chemicals
RKLB,Rocket Lab USA Inc. Common Stock,$4.88,-0.03,-0.611%,2309495092.00,United States,2020,3028090,Industrials,Aerospace
RLAY,Relay Therapeutics Inc. Common Stock,$20.19,-0.23,-1.126%,2440868051.00,United States,2020,1088443,Health Care,Biotechnology: Pharmaceutical Preparations
RLMD,Relmada Therapeutics Inc. Common Stock,$4.19,-0.19,-4.338%,126115661.00,United States,,171767,Health Care,Biotechnology: Pharmaceutical Preparations
RLYB,Rallybio Corporation Common Stock,$7.54,-0.16,-2.078%,285300684.00,United States,2021,90661,Health Care,Biotechnology: Pharmaceutical Preparations
RMBI,Richmond Mutual Bancorporation Inc. Common Stock,$13.70,0.15,1.107%,161594761.00,United States,2019,6081,,
RMBL,RumbleOn Inc. Class B Common Stock,$9.01,0.76,9.212%,145905102.00,United States,,307228,Consumer Discretionary,Automotive Aftermarket
RMBS,Rambus Inc. Common Stock,$43.20,0.05,0.116%,4643222832.00,United States,1997,796855,Technology,Semiconductors
RMCF,Rocky Mountain Chocolate Factory Inc. Common Stock,$5.51,-0.045,-0.81%,34439136.00,United States,,2359,Consumer Staples,Specialty Foods
RMGC,RMG Acquisition Corp. III Class A Ordinary Shares,$10.02,-0.03,-0.299%,604957500.00,United States,2021,4926,Finance,Business Services
RMGCU,RMG Acquisition Corp. III Unit,$10.03,-0.07,-0.693%,0.00,United States,2021,8168,Finance,Business Services
RMGCW,RMG Acquisition Corp. III Warrant,$0.1285,-0.0115,-8.214%,0.00,United States,2021,500,Finance,Business Services
RMNI,Rimini Street Inc. (DE) Common Stock,$4.96,-0.09,-1.782%,437858880.00,United States,2015,255599,Technology,EDP Services
RMR,The RMR Group Inc. Class A Common Stock,$29.84,-0.05,-0.167%,495469984.00,United States,,41407,Finance,Real Estate
RMTI,Rockwell Medical Inc. Common Stock,$1.90,0.02,1.064%,22102079.00,United States,1998,97612,Health Care,Biotechnology: Pharmaceutical Preparations
RNA,Avidity Biosciences Inc. Common Stock,$22.46,-0.38,-1.664%,1492748154.00,United States,2020,582305,Health Care,Biotechnology: Pharmaceutical Preparations
RNAZ,TransCode Therapeutics Inc. Common Stock,$0.7432,-0.0029,-0.389%,9644680.00,United States,2021,88447,Health Care,Biotechnology: Pharmaceutical Preparations
RNER,Mount Rainier Acquisition Corp. Common Stock,$10.03,-0.08,-0.791%,222251761.00,United States,2022,46691,Industrials,Consumer Electronics/Appliances
RNERU,Mount Rainier Acquisition Corp. Unit,$10.41,-0.58,-5.278%,0.00,United States,2021,7923,Industrials,Consumer Electronics/Appliances
RNERW,Mount Rainier Acquisition Corp. Warrant,$0.20,-0.0297,-12.93%,0.00,United States,2022,87366,Industrials,Consumer Electronics/Appliances
RNLX,Renalytix plc American Depositary Shares,$3.08,-0.0427,-1.367%,115333440.00,United Kingdom,2020,30696,Health Care,Medical Specialities
RNST,Renasant Corporation Common Stock,$34.60,0.10,0.29%,1935977398.00,United States,,251763,Finance,Major Banks
RNW,ReNew Energy Global plc Class A Ordinary Shares,$6.18,0.04,0.651%,2394522984.00,United Kingdom,,495530,Utilities,Electric Utilities: Central
RNWWW,ReNew Energy Global plc Warrant,$0.98,0.01,1.031%,0.00,United Kingdom,,1956,Utilities,Electric Utilities: Central
RNXT,RenovoRx Inc. Common Stock,$2.56,0.05,1.992%,23290115.00,United States,2021,28944,Health Care,Biotechnology: Pharmaceutical Preparations
ROAD,Construction Partners Inc. Class A Common Stock,$27.19,-0.13,-0.476%,1433474365.00,United States,2018,122524,Industrials,Engineering & Construction
ROC,ROC Energy Acquisition Corp. Common Stock,$10.30,0.00,0.00%,276565300.00,United States,2021,377,Industrials,Consumer Electronics/Appliances
ROCC,Ranger Oil Corporation Class A Common Stock,$43.95,0.04,0.091%,839016004.00,United States,,242906,Energy,Oil & Gas Production
ROCG,Roth CH Acquisition IV Co. Common Stock,$10.30,0.00,0.00%,152815950.00,United States,2021,6400,Industrials,Consumer Electronics/Appliances
ROCGU,Roth CH Acquisition IV Co. Unit,$10.4441,0.1241,1.203%,0.00,United States,2021,1165,Industrials,Consumer Electronics/Appliances
ROCGW,Roth CH Acquisition IV Co. Warrant,$0.24,0.01,4.348%,0.00,United States,2021,4597,Industrials,Consumer Electronics/Appliances
ROCK,Gibraltar Industries Inc. Common Stock,$51.64,0.71,1.394%,1599340994.00,United States,1993,78765,,
ROCL,Roth CH Acquisition V Co. Common Stock,$10.19,-0.024,-0.235%,151183935.00,United States,2022,400973,Industrials,Consumer Electronics/Appliances
ROCLU,Roth CH Acquisition V Co. Unit,$10.19,0.00,0.00%,0.00,United States,2021,50,Industrials,Consumer Electronics/Appliances
ROCLW,Roth CH Acquisition V Co. Warrant,$0.0542,-0.0058,-9.667%,0.00,United States,2022,250,Industrials,Consumer Electronics/Appliances
ROIC,Retail Opportunity Investments Corp. Common Stock (MD),$15.76,0.13,0.832%,1962731661.00,United States,,527137,Real Estate,Real Estate Investment Trusts
ROIV,Roivant Sciences Ltd. Common Shares,$8.37,-0.02,-0.238%,6071755247.00,United Kingdom,,1284401,Health Care,Biotechnology: Pharmaceutical Preparations
ROIVW,Roivant Sciences Ltd. Warrant,$1.93,-0.0299,-1.526%,0.00,United Kingdom,,12265,Health Care,Biotechnology: Pharmaceutical Preparations
ROKU,Roku Inc. Class A Common Stock,$52.58,0.43,0.825%,7322791151.00,United States,2017,8300312,Telecommunications,Cable & Other Pay Television Services
ROOT,Root Inc. Class A Common Stock,$5.23,-0.03,-0.57%,73743000.00,United States,2020,66003,Finance,Property-Casualty Insurers
ROSE,Rose Hill Acquisition Corporation Class A Ordinary Shares,$10.53,0.00,0.00%,204347813.00,United States,2021,502,Finance,Business Services
ROSEU,Rose Hill Acquisition Corporation Unit,$10.54,0.03,0.285%,0.00,United States,2021,500,Finance,Business Services
ROSEW,Rose Hill Acquisition Corporation Warrant,$0.11,0.00,0.00%,0.00,United States,2021,4905,Finance,Business Services
ROST,Ross Stores Inc. Common Stock,$120.71,0.51,0.424%,41569024496.00,United States,1985,1847325,Consumer Discretionary,Clothing/Shoe/Accessory Stores
ROVR,Rover Group Inc. Class A Common Stock,$3.75,0.02,0.536%,689074376.00,United States,2021,372266,Consumer Discretionary,Other Consumer Services
RPAY,Repay Holdings Corporation Class A Common Stock,$9.69,0.27,2.866%,878777137.00,United States,2018,934016,Technology,EDP Services
RPD,Rapid7 Inc. Common Stock,$36.50,1.54,4.405%,2162111080.00,United States,2015,704507,Technology,Computer Software: Prepackaged Software
RPHM,Reneo Pharmaceuticals Inc. Common Stock,$2.71,0.12,4.633%,66475341.00,United States,2021,13805,Health Care,Biotechnology: Pharmaceutical Preparations
RPID,Rapid Micro Biosystems Inc. Class A Common Stock,$1.46,0.00,0.00%,61311656.00,United States,2021,6045,Health Care,Medical Specialities
RPRX,Royalty Pharma plc Class A Ordinary Shares ,$38.71,-0.01,-0.026%,17075143737.00,United States,2020,1432877,Health Care,Biotechnology: Pharmaceutical Preparations
RPTX,Repare Therapeutics Inc. Common Shares,$12.46,-0.21,-1.657%,522840415.00,Canada,2020,142251,Health Care,Pharmaceuticals and Biotechnology
RRBI,Red River Bancshares Inc. Common Stock,$50.00,0.15,0.301%,359195750.00,United States,2019,1728,Finance,Commercial Banks
RRGB,Red Robin Gourmet Burgers Inc. Common Stock,$8.73,0.09,1.042%,139051833.00,United States,2002,98597,Consumer Discretionary,Restaurants
RRR,Red Rock Resorts Inc. Class A Common Stock,$44.81,0.51,1.151%,2598998775.00,United States,2016,222932,Consumer Discretionary,Recreational Games/Products/Toys
RSLS,ReShape Lifesciences Inc. Common Stock,$8.17,0.61,8.069%,571900.00,United States,2016,43055,Health Care,Biotechnology: Electromedical & Electrotherapeutic Apparatus
RSSS,Research Solutions Inc Common Stock,$2.00,-0.0299,-1.473%,58594164.00,United States,,9007,Technology,Computer Software: Prepackaged Software
RSVR,Reservoir Media Inc. Common Stock,$7.00,0.01,0.143%,450617328.00,United States,2021,19809,Consumer Discretionary,Movies/Entertainment
RSVRW,Reservoir Media Inc. Warrant,$1.60,0.15,10.345%,0.00,United States,2021,1306,Consumer Discretionary,Movies/Entertainment
RTC,Baijiayun Group Ltd. Class A Ordinary Shares,$9.58,-0.15,-1.542%,802668021.00,China,2006,21833,Industrials,Specialty Chemicals
RTL,The Necessity Retail REIT Inc. Class A Common Stock,$6.66,0.10,1.524%,893933925.00,United States,,384497,Real Estate,Real Estate Investment Trusts
RTLPO,The Necessity Retail REIT Inc. 7.375% Series C Cumulative Redeemable Preferred Stock,$23.21,0.48,2.112%,0.00,United States,,6722,Real Estate,Real Estate Investment Trusts
