Symbol,Name,Last Sale,Net Change,% Change,Market Cap,Country,IPO Year,Volume,Sector,Industry
CSCO,Cisco Systems Inc. Common Stock (DE),$48.34,0.36,0.75%,198585702065.00,United States,1990,12952001,Telecommunications,Computer Communications Equipment
CSGP,CoStar Group Inc. Common Stock,$78.71,1.34,1.732%,32010574623.00,United States,1998,1870390,Finance,Real Estate
CSGS,CSG Systems International Inc. Common Stock,$59.43,0.59,1.003%,1872367883.00,United States,1996,86173,Technology,EDP Services
CSII,Cardiovascular Systems Inc. Common Stock,$13.525,-0.035,-0.258%,566457377.00,United States,1981,176991,Health Care,Medical/Dental Instruments
CSIQ,Canadian Solar Inc. Common Shares (ON),$41.00,-0.85,-2.031%,2635021661.00,Canada,2006,1043257,,
CSLM,Consilium Acquisition Corp I Ltd. Class A Ordinary Share,$10.23,0.02,0.196%,242642813.00,United States,2022,427350,Finance,Business Services
CSLMW,Consilium Acquisition Corp I Ltd. Warrant,$0.04,0.00,0.00%,0.00,United States,2022,50,Finance,Business Services
CSPI,CSP Inc. Common Stock,$11.05,0.09,0.821%,50330407.00,United States,1982,4376,Technology,EDP Services
CSQ,Calamos Strategic Total Return Common Stock,$14.36,0.20,1.412%,2281626252.00,United States,2004,163823,Finance,Finance Companies
CSSE,Chicken Soup for the Soul Entertainment Inc. Class A Common Stock,$5.92,0.18,3.136%,74881476.00,United States,2017,101225,Consumer Discretionary,Movies/Entertainment
CSSEL,Chicken Soup for the Soul Entertainment Inc. Warrant,$0.0398,0.0053,15.362%,0.00,United States,,214369,Consumer Discretionary,Movies/Entertainment
CSSEN,Chicken Soup for the Soul Entertainment Inc. 9.50% Notes due 2025,$25.22,0.07,0.278%,0.00,United States,,201,Consumer Discretionary,Movies/Entertainment
CSSEP,Chicken Soup for the Soul Entertainment Inc. 9.75% Series A Cumulative Redeemable Perpetual Preferred Stock,$20.89,-0.06,-0.286%,0.00,United States,,13518,Consumer Discretionary,Movies/Entertainment
CSTE,Caesarstone Ltd. Ordinary Shares,$6.00,-0.05,-0.826%,207014868.00,Israel,2012,59099,Industrials,Building Materials
CSTL,Castle Biosciences Inc. Common Stock,$25.65,-0.89,-3.353%,675917924.00,United States,2019,72827,Health Care,Medical Specialities
CSTR,CapStar Financial Holdings Inc. Common Stock,$16.83,0.22,1.325%,365453015.00,United States,2016,56067,Finance,Major Banks
CSWC,Capital Southwest Corporation Common Stock,$18.99,0.16,0.85%,608714993.00,United States,,205038,Finance,Finance/Investors Services
CSWI,CSW Industrials Inc. Common Stock,$132.57,3.47,2.688%,2051768126.00,United States,,67374,Industrials,Home Furnishings
CSX,CSX Corporation Common Stock,$30.15,-0.90,-2.899%,63387623179.00,United States,,25563062,Industrials,Railroads
CTAQ,Carney Technology Acquisition Corp. II Class A Common Stock,$10.16,-0.01,-0.098%,520319000.00,United States,2021,113201,Industrials,Consumer Electronics/Appliances
CTAQU,Carney Technology Acquisition Corp. II Units,$10.17,0.00,0.00%,0.00,United States,2020,97435,Industrials,Consumer Electronics/Appliances
CTAQW,Carney Technology Acquisition Corp. II Warrant,$0.0711,0.0011,1.571%,0.00,United States,2021,40803,Industrials,Consumer Electronics/Appliances
CTAS,Cintas Corporation Common Stock,$441.09,4.22,0.966%,44823777082.00,United States,1983,256671,Consumer Discretionary,Business Services
CTBI,Community Trust Bancorp Inc. Common Stock,$41.84,0.06,0.144%,749700835.00,United States,,36214,Finance,Major Banks
CTG,Computer Task Group Inc. Common Stock,$7.18,0.06,0.843%,112815398.00,United States,,13023,Technology,EDP Services
CTHR,Charles & Colvard Ltd Common Stock,$0.95,0.0201,2.162%,28827707.00,United States,1997,24137,Consumer Discretionary,Consumer Specialties
CTIB,Yunhong CTI Ltd. Common Stock,$1.73,-0.17,-8.947%,27782227.00,United States,1997,199251,Miscellaneous,Diversified Commercial Services
CTIC,CTI BioPharma Corp. (DE) Common Stock,$5.82,-0.19,-3.161%,738524261.00,United States,1997,3077053,Health Care,Biotechnology: Pharmaceutical Preparations
CTKB,Cytek Biosciences Inc. Common Stock,$11.64,0.11,0.954%,1569693099.00,United States,2021,529273,Health Care,Biotechnology: Electromedical & Electrotherapeutic Apparatus
CTLP,Cantaloupe Inc. Common Stock,$5.06,-0.07,-1.365%,366642793.00,United States,,185476,Technology,EDP Services
CTMX,CytomX Therapeutics Inc. Common Stock,$2.78,0.16,6.107%,183714540.00,United States,2015,3659219,Health Care,Biotechnology: Pharmaceutical Preparations
CTRM,Castor Maritime Inc. Common Shares,$1.17,-0.02,-1.681%,110693803.00,Cyprus,,343586,Consumer Discretionary,Marine Transportation
CTRN,Citi Trends Inc. Common Stock,$31.40,1.06,3.494%,262386376.00,United States,2005,73339,,
CTSH,Cognizant Technology Solutions Corporation Class A Common Stock,$64.66,0.52,0.811%,33230159793.00,United States,1998,3229500,Technology,EDP Services
CTSO,Cytosorbents Corporation Common Stock,$2.33,-0.20,-7.905%,101671216.00,United States,,89005,Health Care,Medical/Dental Instruments
CTXR,Citius Pharmaceuticals Inc. Common Stock,$1.31,0.08,6.504%,191536580.00,United States,,1166232,Health Care,Biotechnology: Pharmaceutical Preparations
CUBA,Herzfeld Caribbean Basin Fund Inc. (The) Common Stock,$4.07,0.00,0.00%,26167072.00,United States,,4198,Finance,Investment Managers
CUE,Cue Biopharma Inc. Common Stock,$3.535,0.045,1.289%,152155407.00,United States,2018,100569,Health Care,Biotechnology: Pharmaceutical Preparations
CUEN,Cuentas Inc. Common Stock,$0.82,0.0958,13.228%,15817582.00,United States,,9004180,Technology,Computer Software: Prepackaged Software
CUENW,Cuentas Inc. Warrant,$0.10,-0.0304,-23.313%,0.00,United States,,3737,Technology,Computer Software: Prepackaged Software
CULL,Cullman Bancorp Inc. Common Stock,$11.86,-0.07,-0.587%,87833891.00,United States,2021,1615,Finance,Savings Institutions
CURI,CuriosityStream Inc. Class A Common Stock,$1.88,0.00,0.00%,99275496.00,United States,2020,115248,Industrials,Broadcasting
CURIW,CuriosityStream Inc. Warrant,$0.1165,-0.0035,-2.917%,0.00,United States,2020,207,Industrials,Broadcasting
CUTR,Cutera Inc. Common Stock,$34.24,0.07,0.205%,671633967.00,United States,2004,518107,Health Care,Biotechnology: Electromedical & Electrotherapeutic Apparatus
CVAC,CureVac N.V. Ordinary Shares,$11.25,0.16,1.443%,2140686405.00,Germany,2020,761571,Health Care,Biotechnology: Pharmaceutical Preparations
CVBF,CVB Financial Corporation Common Stock,$23.88,-0.30,-1.241%,3338615064.00,United States,,930909,Finance,Major Banks
CVCO,Cavco Industries Inc. Common Stock When Issued,$267.47,4.24,1.611%,2382980902.00,United States,,66956,Consumer Discretionary,Homebuilding
CVCY,Central Valley Community Bancorp Common Stock,$21.79,0.12,0.554%,255640520.00,United States,,14531,Finance,Major Banks
CVGI,Commercial Vehicle Group Inc. Common Stock,$7.44,0.14,1.918%,248302426.00,United States,2004,73830,Consumer Discretionary,Auto Parts:O.E.M.
CVGW,Calavo Growers Inc. Common Stock,$32.05,-0.54,-1.657%,568299735.00,United States,,42380,Consumer Discretionary,Specialty Foods
CVKD,Cadrenal Therapeutics Inc. Common Stock,$2.84,-0.06,-2.069%,33042193.00,United States,2023,119562,Health Care, Medicinal Chemicals and Botanical Products 
CVLG,Covenant Logistics Group Inc. Class A Common Stock,$30.01,-8.42,-21.91%,404963643.00,United States,,904129,Industrials,Trucking Freight/Courier Services
CVLT,Commvault Systems Inc. Common Stock,$60.90,2.24,3.819%,2712001114.00,United States,2006,288855,Technology,Computer Software: Prepackaged Software
CVLY,Codorus Valley Bancorp Inc Common Stock,$23.83,0.12,0.506%,227686237.00,United States,,6157,Finance,Savings Institutions
CVRX,CVRx Inc. Common Stock,$14.37,0.02,0.139%,295794422.00,United States,2021,56767,Health Care,Biotechnology: Electromedical & Electrotherapeutic Apparatus
CVT,Cvent Holding Corp. Common Stock,$6.93,0.33,5.00%,3381294609.00,United States,1987,360875,Technology,Computer Software: Prepackaged Software
CVV,CVD Equipment Corporation Common Stock,$12.38,1.82,17.235%,83700412.00,United States,,351437,Technology,Industrial Machinery/Components
CWBC,Community West Bancshares Common Stock,$14.75,0.00,0.00%,129206504.00,United States,,284,Finance,Major Banks
CWBR,CohBar Inc. Common Stock,$2.08,-0.11,-5.023%,6046406.00,United States,,13566,Health Care,Biotechnology: In Vitro & In Vivo Diagnostic Substances
CWCO,Consolidated Water Co. Ltd. Ordinary Shares,$14.27,-0.13,-0.903%,223475207.00,Cayman Islands,,38008,Utilities,Water Supply
CWST,Casella Waste Systems Inc. Class A Common Stock,$79.91,-1.13,-1.394%,4129769017.00,United States,1997,160658,Utilities,Environmental Services
CXDO,Crexendo Inc. Common Stock,$1.81,0.04,2.26%,45644046.00,United States,,7238,Consumer Discretionary,Telecommunications Equipment
CYAD,Celyad Oncology SA American Depositary Shares,$1.57,-0.16,-9.249%,35472511.00,Belgium,2015,155445,Health Care,Biotechnology: Pharmaceutical Preparations
CYAN,Cyanotech Corporation Common Stock,$1.40,-0.0393,-2.73%,8780759.00,United States,,19475,Consumer Staples,Farming/Seeds/Milling
CYBR,CyberArk Software Ltd. Ordinary Shares,$138.82,3.24,2.39%,5652240792.00,Israel,2014,297328,Technology,Computer Software: Prepackaged Software
CYCC,Cyclacel Pharmaceuticals Inc. Common Stock,$0.95,0.08,9.195%,11912230.00,United States,,33013,Health Care,Biotechnology: Pharmaceutical Preparations
CYCCP,Cyclacel Pharmaceuticals Inc. 6% Convertible Preferred Stock,$12.00,0.82,7.335%,0.00,United States,,703,Health Care,Biotechnology: Pharmaceutical Preparations
CYCN,Cyclerion Therapeutics Inc. Common Stock,$0.6903,0.0757,12.317%,30024035.00,United States,,262105,Health Care,Biotechnology: Pharmaceutical Preparations
CYN,Cyngn Inc. Common Stock,$0.77,-0.0052,-0.671%,25934208.00,United States,2021,230783,Technology,EDP Services
CYRN,CYREN Ltd. Ordinary Shares,$0.78,-0.0399,-4.866%,6239850.00,United States,,75059,Technology,Computer Software: Prepackaged Software
CYRX,CryoPort Inc. Common Stock,$22.50,0.38,1.718%,1102496378.00,United States,,397673,,
CYT,Cyteir Therapeutics Inc. Common Stock,$1.59,-0.08,-4.79%,56347870.00,United States,2021,28382,Health Care,Biotechnology: Pharmaceutical Preparations
CYTH,Cyclo Therapeutics Inc. Common Stock,$1.65,-0.10,-5.714%,15529549.00,United States,,40501,Health Care,Biotechnology: Pharmaceutical Preparations
CYTHW,Cyclo Therapeutics Inc. Warrant,$0.2374,0.0204,9.401%,0.00,United States,,3400,Health Care,Biotechnology: Pharmaceutical Preparations
CYTK,Cytokinetics Incorporated Common Stock,$43.25,0.29,0.675%,4092790793.00,United States,2004,494633,Health Care,Biotechnology: Pharmaceutical Preparations
CYTO,Altamira Therapeutics Ltd. 0.2 Common Shares (Bermuda),$3.18,-0.16,-4.79%,4121576.00,Bermuda,2014,25119,Health Care,Biotechnology: Pharmaceutical Preparations
CYXT,Cyxtera Technologies Inc. Class A Common Stock,$2.71,0.15,5.859%,486763444.00,United States,2020,222667,Technology,EDP Services
CZFS,Citizens Financial Services Inc. Common Stock,$77.7808,0.0908,0.117%,308883813.00,United States,,1540,Finance,Major Banks
CZNC,Citizens & Northern Corp Common Stock,$23.18,-0.23,-0.982%,359299643.00,United States,,9427,Finance,Major Banks
CZR,Caesars Entertainment Inc. Common Stock,$52.53,0.68,1.311%,11271157496.00,United States,,3497439,Consumer Discretionary,Hotels/Resorts
CZWI,Citizens Community Bancorp Inc. Common Stock,$12.70,0.24,1.926%,132399011.00,United States,2006,4083,Finance,Savings Institutions
DADA,Dada Nexus Limited American Depositary Shares,$14.73,0.06,0.409%,3764827517.00,China,2020,1426196,Consumer Discretionary,Department/Specialty Retail Stores
DAIO,Data I/O Corporation Common Stock,$4.17,-0.10,-2.342%,36764309.00,United States,1981,8417,Technology,Industrial Machinery/Components
DAKT,Daktronics Inc. Common Stock,$3.62,0.32,9.697%,164585935.00,United States,1994,259581,Industrials,Office Equipment/Supplies/Services
DALN,DallasNews Corporation Series A Common Stock,$5.12,0.3223,6.718%,27404749.00,United States,,61855,Consumer Discretionary,Newspapers/Magazines
DALS,DA32 Life Science Tech Acquisition Corp. Class A Common Stock,$10.02,-0.022,-0.219%,257013000.00,United States,2021,450006,Industrials,Consumer Electronics/Appliances
DARE,Dare Bioscience Inc. Common Stock,$1.36,0.02,1.493%,115328000.00,United States,2014,1476387,Health Care,Biotechnology: Pharmaceutical Preparations
DATS,DatChat Inc. Common Stock,$0.657,0.0659,11.149%,13532504.00,United States,2021,224176,Technology,Computer Software: Prepackaged Software
DATSW,DatChat Inc. Series A Warrant,$0.0801,-0.0076,-8.666%,0.00,United States,2021,139,Technology,Computer Software: Prepackaged Software
DAVE,Dave Inc. Class A Common Stock,$9.28,0.32,3.571%,109650977.00,United States,,44442,Technology,Retail: Computer Software & Peripheral Equipment
DAVEW,Dave Inc. Warrants,$0.0354,0.0014,4.118%,0.00,United States,,29561,Technology,Retail: Computer Software & Peripheral Equipment
DAWN,Day One Biopharmaceuticals Inc. Common Stock,$21.54,-0.56,-2.534%,1584256790.00,United States,2021,352949,Health Care,Biotechnology: Pharmaceutical Preparations
DBGI,Digital Brands Group Inc. Common Stock,$2.76,-0.16,-5.479%,5990544.00,United States,2021,507021,Consumer Discretionary,Apparel
DBGIW,Digital Brands Group Inc. Warrant,$1.90,0.00,0.00%,0.00,United States,2021,33,Consumer Discretionary,Apparel
DBTX,Decibel Therapeutics Inc. Common Stock,$3.12,0.00,0.00%,77889246.00,United States,2021,26914,Health Care,Biotechnology: Pharmaceutical Preparations
DBVT,DBV Technologies S.A. American Depositary Shares,$1.32,-0.08,-5.714%,248072592.00,France,2014,234449,Health Care,Biotechnology: Pharmaceutical Preparations
DBX,Dropbox Inc. Class A Common Stock,$23.38,0.41,1.785%,8480776518.00,United States,2018,1980309,Technology,Computer Software: Prepackaged Software
DCBO,Docebo Inc. Common Shares,$36.84,1.12,3.135%,1212274134.00,Canada,,54875,,
DCFC,Tritium DCFC Limited Ordinary Shares,$1.31,-0.05,-3.676%,203690401.00,Australia,,2615554,Technology,Electronic Components
DCFCW,Tritium DCFC Limited Warrant,$0.4187,-0.0188,-4.297%,0.00,Australia,,3893,Technology,Electronic Components
DCGO,DocGo Inc. Common Stock,$9.89,0.40,4.215%,1012846392.00,United States,2020,1251473,Health Care,Managed Health Care
DCOM,Dime Community Bancshares Inc. Common Stock,$32.43,-0.11,-0.338%,1250944021.00,United States,,77276,Finance,Savings Institutions
DCOMP,Dime Community Bancshares Inc. Fixed-Rate Non-Cumulative Perpetual Preferred Stock Series A,$21.96,0.3049,1.408%,0.00,United States,,7989,Finance,Savings Institutions
DCPH,Deciphera Pharmaceuticals Inc. Common Stock,$17.98,0.11,0.616%,1340980692.00,United States,2017,744195,Health Care,Biotechnology: Pharmaceutical Preparations
DCRD,Decarbonization Plus Acquisition Corporation IV Class A Ordinary Share,$11.0095,-0.6905,-5.902%,435219297.00,United States,2021,72661,Finance,Business Services
DCRDU,Decarbonization Plus Acquisition Corporation IV Unit,$11.144,-0.546,-4.671%,0.00,United States,2021,1233,Finance,Business Services
DCRDW,Decarbonization Plus Acquisition Corporation IV Warrant,$0.7089,0.0088,1.257%,0.00,United States,2021,150300,Finance,Business Services
DCT,Duck Creek Technologies Inc. Common Stock,$18.97,-0.03,-0.158%,2520889325.00,United States,2020,1597464,Technology,Retail: Computer Software & Peripheral Equipment
DCTH,Delcath Systems Inc. Common Stock,$3.73,-0.015,-0.401%,37473710.00,United States,,1932,Health Care,Medical Specialities
DDI,DoubleDown Interactive Co. Ltd. American Depository Shares,$10.22,-0.22,-2.107%,506436157.00,South Korea,2021,8775,Technology,EDP Services
DDOG,Datadog Inc. Class A Common Stock,$76.00,5.25,7.42%,24134547688.00,United States,2019,6872103,Technology,EDP Services
DECA,Denali Capital Acquisition Corp. Class A Ordinary Shares,$10.39,0.04,0.386%,112445775.00,United States,2022,103317,Finance,Business Services
DECAU,Denali Capital Acquisition Corp. Unit,$10.28,0.03,0.293%,0.00,United States,2022,71895,Finance,Business Services
DECAW,Denali Capital Acquisition Corp. Warrant,$0.075,0.04,114.286%,0.00,United States,2022,170104,Finance,Business Services
DENN,Denny's Corporation Common Stock,$11.93,-0.03,-0.251%,682792959.00,United States,,507672,Consumer Discretionary,Restaurants
DERM,Journey Medical Corporation Common Stock,$2.05,-0.14,-6.393%,36419685.00,United States,2021,8941,Health Care,Biotechnology: Pharmaceutical Preparations
DFFN,Diffusion Pharmaceuticals Inc. Common Stock,$6.03,0.00,0.00%,12297835.00,United States,,4910,Health Care,Biotechnology: Pharmaceutical Preparations
DFLI,Dragonfly Energy Holdings Corp. Common Stock,$7.10,-0.54,-7.068%,307236369.00,United States,2021,62889,Technology,Electronic Components
DFLIW,Dragonfly Energy Holdings Corp. Warrant,$0.36,-0.02,-5.263%,0.00,United States,2021,1760,Technology,Electronic Components
DGHI,Digihost Technology Inc. Common Subordinate Voting Shares,$1.89,0.43,29.452%,52585117.00,Canada,,448674,,
DGICA,Donegal Group Inc. Class A Common Stock,$15.15,-0.02,-0.132%,491891351.00,United States,,17809,Finance,Property-Casualty Insurers
DGICB,Donegal Group Inc. Class B Common Stock,$15.41,-0.54,-3.386%,500333051.00,United States,1986,2289,Finance,Property-Casualty Insurers
DGII,Digi International Inc. Common Stock,$34.74,0.08,0.231%,1239056051.00,United States,1989,155530,Technology,Computer peripheral equipment
DGLY,Digital Ally Inc. Common Stock,$0.3198,0.0088,2.83%,17238309.00,United States,,390904,Technology,Security Systems Services
DGNU,Dragoneer Growth Opportunities Corp. III Class A Ordinary Shares,$9.89,0.00,0.00%,532423284.00,United States,2021,192358,Finance,Business Services
DH,Definitive Healthcare Corp. Class A Common Stock,$11.77,0.05,0.427%,1236792330.00,United States,2021,652151,Technology,Computer Software: Prepackaged Software
DHAC,Digital Health Acquisition Corp. Common Stock,$10.71,-0.08,-0.741%,44190777.00,United States,2021,1349,Industrials,Consumer Electronics/Appliances
DHACW,Digital Health Acquisition Corp. Warrant,$0.1275,-0.0059,-4.423%,0.00,United States,2021,10700,Industrials,Consumer Electronics/Appliances
DHC,Diversified Healthcare Trust Common Shares of Beneficial Interest,$0.7409,0.0229,3.189%,177596442.00,United States,,2074780,Real Estate,Real Estate Investment Trusts
DHCA,DHC Acquisition Corp. Class A ordinary share,$10.14,-0.01,-0.099%,392228788.00,United States,2021,17960,Finance,Business Services
DHCAU,DHC Acquisition Corp. Unit,$10.12,-0.0201,-0.198%,0.00,United States,2021,302,Finance,Business Services
DHCAW,DHC Acquisition Corp. Warrant,$0.018,0.00,0.00%,0.00,United States,2021,233,Finance,Business Services
DHCNI,Diversified Healthcare Trust 5.625% Senior Notes due 2042,$12.76,0.51,4.163%,0.00,United States,,16678,Real Estate,Real Estate Investment Trusts
DHCNL,Diversified Healthcare Trust 6.25% Senior Notes Due 2046,$13.69,0.50,3.791%,0.00,United States,,15960,Real Estate,Real Estate Investment Trusts
DHHC,DiamondHead Holdings Corp. Class A Common Stock,$10.15,0.02,0.197%,437718750.00,United States,2021,6775,Industrials,Consumer Electronics/Appliances
DHHCU,DiamondHead Holdings Corp. Unit,$10.69,0.65,6.474%,0.00,United States,2021,100,Industrials,Consumer Electronics/Appliances
DHHCW,DiamondHead Holdings Corp. Warrant,$0.22,0.00,0.00%,0.00,United States,2021,80,Industrials,Consumer Electronics/Appliances
DHIL,Diamond Hill Investment Group Inc. Class A Common Stock,$188.00,2.18,1.173%,566980740.00,United States,,9867,Finance,Investment Managers
DIBS,1stdibs.com Inc. Common Stock,$6.06,0.12,2.02%,235920460.00,United States,2021,77219,Miscellaneous,Diversified Commercial Services
DICE,DICE Therapeutics Inc. Common Stock,$31.81,-0.07,-0.22%,1516156213.00,United States,2021,439275,Health Care,Biotechnology: Pharmaceutical Preparations
DIOD,Diodes Incorporated Common Stock,$90.06,1.80,2.039%,4095002353.00,United States,,151463,Technology,Semiconductors
DISA,Disruptive Acquisition Corporation I Class A Ordinary Shares,$10.15,0.01,0.099%,348906250.00,United States,2021,2000,Finance,Business Services
DISAU,Disruptive Acquisition Corporation I Unit,$10.14,-0.01,-0.099%,0.00,United States,2021,500,Finance,Business Services
DISH,DISH Network Corporation Class A Common Stock,$14.41,-0.27,-1.839%,7647480247.00,United States,1995,5292472,Consumer Discretionary,Telecommunications Equipment
DJCO,Daily Journal Corp. (S.C.) Common Stock,$304.48,12.78,4.381%,419276876.00,United States,,1236,Technology,Retail: Computer Software & Peripheral Equipment
DKDCA,Data Knights Acquisition Corp. Class A Common Stock,$10.58,-0.01,-0.094%,158278652.00,United Kingdom,2021,438,Industrials,Consumer Electronics/Appliances
DKDCU,Data Knights Acquisition Corp. Unit,$10.59,0.00,0.00%,0.00,United Kingdom,2021,97,Industrials,Consumer Electronics/Appliances
DKDCW,Data Knights Acquisition Corp. Warrant,$0.035,-0.003,-7.895%,0.00,United Kingdom,2021,3389,Industrials,Consumer Electronics/Appliances
DKNG,DraftKings Inc. Class A Common Stock,$14.30,-0.25,-1.718%,6418529761.00,United States,2019,12364495,Consumer Discretionary,Services-Misc. Amusement & Recreation
DLHC,DLH Holdings Corp.,$11.66,0.09,0.778%,158274904.00,United States,,14116,Consumer Discretionary,Business Services
DLO,DLocal Limited Class A Common Shares,$16.17,0.16,0.999%,4786078921.00,Uruguay,2021,811416,Consumer Discretionary,Business Services
DLPN,Dolphin Entertainment Inc. Common Stock,$2.48,0.09,3.766%,25330849.00,United States,,14911,Consumer Discretionary,Advertising
DLTH,Duluth Holdings Inc. Class B Common Stock,$6.59,0.15,2.329%,220255626.00,United States,2015,90872,Consumer Discretionary,Department/Specialty Retail Stores
DLTR,Dollar Tree Inc. Common Stock,$150.45,0.89,0.595%,33277204866.00,United States,1995,1608799,Consumer Discretionary,Department/Specialty Retail Stores
DMAC,DiaMedica Therapeutics Inc. Common Stock,$1.44,-0.08,-5.263%,38078016.00,United States,2018,76347,Health Care,Pharmaceuticals and Biotechnology
DMAQ,Deep Medicine Acquisition Corp. Class A Common Stock,$10.30,0.00,0.00%,169261960.00,United States,2021,1,Industrials,Consumer Electronics/Appliances
DMAQR,Deep Medicine Acquisition Corp. Rights,$0.11,0.00,0.00%,0.00,United States,2021,2,,
DMLP,Dorchester Minerals L.P. Common Units Representing Limited Partnership Interests,$31.68,-0.24,-0.752%,1215608898.00,United States,,223988,Energy,Oil & Gas Production
DMRC,Digimarc Corporation Common Stock,$21.35,-0.45,-2.064%,427767639.00,United States,,60521,Technology,EDP Services
DMTK,DermTech Inc. Common Stock,$6.03,0.00,0.00%,182194671.00,United States,2017,824296,Health Care,Managed Health Care
DNAB,Social Capital Suvretta Holdings Corp. II Class A Ordinary Shares,$10.10,0.00,0.00%,322089000.00,United States,2021,546,Finance,Business Services
DNAD,Social Capital Suvretta Holdings Corp. IV Class A Ordinary Shares,$10.10,0.00,0.00%,322089000.00,United States,2021,1509,Finance,Business Services
DNLI,Denali Therapeutics Inc. Common Stock,$30.53,-0.28,-0.909%,4146391284.00,United States,2017,278592,Health Care,Biotechnology: Biological Products (No Diagnostic Substances)
DNUT,Krispy Kreme Inc. Common Stock,$11.99,0.01,0.083%,2007571105.00,United States,2021,974232,Consumer Discretionary,Specialty Foods
DOCU,DocuSign Inc. Common Stock,$58.60,1.27,2.215%,11782945073.00,United States,2018,2829640,Technology,EDP Services
DOGZ,Dogness (International) Corporation Class A Common Stock,$0.97,0.02,2.105%,38096031.00,China,2017,26416,Consumer Discretionary,Miscellaneous manufacturing industries
DOMH,Dominari Holdings Inc. Common Stock,$3.83,-0.12,-3.038%,21007918.00,United States,,16892,Health Care, Medicinal Chemicals and Botanical Products 
DOMO,Domo Inc. Class B Common Stock,$14.30,0.63,4.609%,493993014.00,United States,2018,1365859,Technology,Computer Software: Prepackaged Software
DOOO,BRP Inc. (Recreational Products) Common Subordinate Voting Shares,$81.45,1.44,1.80%,6413818287.00,Canada,,66786,,
DORM,Dorman Products Inc. Common Stock,$93.36,2.38,2.616%,2933238162.00,United States,,85702,Consumer Discretionary,Auto Parts:O.E.M.
DOX,Amdocs Limited Ordinary Shares,$91.28,0.38,0.418%,11028139431.00,Guernsey,,581439,Technology,EDP Services
DOYU,DouYu International Holdings Limited ADS,$1.88,0.10,5.618%,596869619.00,China,2019,1441241,Technology,Computer Software: Programming Data Processing
DPCS,DP Cap Acquisition Corp I Class A Ordinary Shares,$10.33,0.00,0.00%,296987500.00,United States,2021,77,Finance,Business Services
DPCSU,DP Cap Acquisition Corp I Unit,$10.28,0.00,0.00%,0.00,United States,2021,1,Finance,Business Services
DPCSW,DP Cap Acquisition Corp I Warrants,$0.0618,-0.0082,-11.714%,0.00,United States,2021,15268,Finance,Business Services
DPRO,Draganfly Inc. Common Shares,$1.42,-0.04,-2.74%,47998174.00,Canada,,463331,Consumer Discretionary,Electronic Components
DRCT,Direct Digital Holdings Inc. Class A Common Stock,$4.46,0.28,6.699%,63233880.00,United States,2022,38675,Consumer Discretionary,Advertising
DRCTW,Direct Digital Holdings Inc. Warrant,$0.7763,0.00,0.00%,0.00,United States,2022,30,Consumer Discretionary,Advertising
DRIO,DarioHealth Corp. Common Stock,$5.97,0.01,0.168%,153306078.00,Israel,,55958,Health Care,Medical/Dental Instruments
DRMA,Dermata Therapeutics Inc. Common Stock,$0.286,0.007,2.509%,3524049.00,United States,2021,1005504,Health Care,Biotechnology: Pharmaceutical Preparations
DRMAW,Dermata Therapeutics Inc. Warrant,$0.038,0.0196,106.522%,0.00,United States,2021,300,Health Care,Biotechnology: Pharmaceutical Preparations
DRRX,DURECT Corporation Common Stock,$6.51,0.00,0.00%,148336749.00,United States,2000,29828,Health Care,Biotechnology: Pharmaceutical Preparations
DRS,Leonardo DRS Inc. Common Stock,$13.16,0.22,1.70%,3424064342.00,Israel,,902024,Industrials,Military/Government/Technical
DRTS,Alpha Tau Medical Ltd. Ordinary Shares,$4.00,-0.25,-5.882%,276046200.00,Israel,,47252,Health Care,Biotechnology: Pharmaceutical Preparations
