Symbol,Name,Last Sale,Net Change,% Change,Market Cap,Country,IPO Year,Volume,Sector,Industry
INTR,Inter & Co. Inc. Class A Common Shares,$2.50,-0.09,-3.475%,1002898853.00,Brazil,,535758,,
INTU,Intuit Inc. Common Stock,$412.55,10.65,2.65%,115895753143.00,United States,1993,1282324,Technology,Computer Software: Prepackaged Software
INTZ,Intrusion Inc. Common Stock,$3.75,0.50,15.385%,79298310.00,United States,,32407,Technology,Security Systems Services
INVA,Innoviva Inc. Common Stock,$12.68,0.26,2.093%,884850786.00,United States,2004,862958,Health Care,Biotechnology: Pharmaceutical Preparations
INVE,Identiv Inc. Common Stock,$7.85,0.00,0.00%,176728063.00,United States,,54516,Technology,Computer peripheral equipment
INVO,INVO BioScience Inc. Common Stock,$0.58,-0.03,-4.918%,7056259.00,United States,,8583,Health Care,Medical/Dental Instruments
INVZ,Innoviz Technologies Ltd. Ordinary shares,$5.12,-0.12,-2.29%,695344973.00,Israel,,1080422,Consumer Discretionary,Auto Parts:O.E.M.
INVZW,Innoviz Technologies Ltd. Warrant,$1.348,0.063,4.903%,0.00,Israel,,1552,Consumer Discretionary,Auto Parts:O.E.M.
INZY,Inozyme Pharma Inc. Common Stock,$2.10,0.35,20.00%,84828162.00,United States,2020,347976,Health Care,Biotechnology: Pharmaceutical Preparations
IOAC,Innovative International Acquisition Corp. Class A Ordinary Shares,$10.495,0.005,0.048%,336994450.00,United States,2022,2689,Finance,Business Services
IOACW,Innovative International Acquisition Corp. Warrants,$0.0474,-0.0001,-0.211%,0.00,United States,2022,2000,Finance,Business Services
IOBT,IO Biotech Inc. Common Stock,$2.79,0.01,0.36%,80394595.00,Denmark,2021,16569,Health Care,Biotechnology: Pharmaceutical Preparations
IONM,Assure Holdings Corp. Common Stock,$0.32,0.00,0.00%,6568063.00,United States,,43979,Health Care,Assisted Living Services
IONR,ioneer Ltd American Depositary Shares,$13.35,-0.05,-0.373%,700875000.00,Australia,,11942,,
IONS,Ionis Pharmaceuticals Inc. Common Stock,$39.38,-0.37,-0.931%,5593942232.00,United States,,730275,Health Care,Biotechnology: Pharmaceutical Preparations
IOSP,Innospec Inc. Common Stock,$110.98,1.06,0.964%,5496810989.00,United States,,37188,Industrials,Industrial Specialties
IOVA,Iovance Biotherapeutics Inc. Common Stock,$7.69,-0.05,-0.646%,1213794068.00,United States,,5457960,Health Care,Biotechnology: Pharmaceutical Preparations
IPA,ImmunoPrecise Antibodies Ltd. Common Stock,$4.41,-0.15,-3.289%,109965326.00,Canada,,36548,Health Care,Pharmaceuticals and Biotechnology
IPAR,Inter Parfums Inc. Common Stock,$112.61,-1.27,-1.115%,3589514131.00,United States,,94247,Consumer Discretionary,Package Goods/Cosmetics
IPAX,Inflection Point Acquisition Corp. Class A Ordinary Share,$10.11,0.015,0.149%,416721563.00,United States,2021,25492,Finance,Business Services
IPAXU,Inflection Point Acquisition Corp. Units,$10.22,0.03,0.294%,0.00,United States,2021,1850,Finance,Business Services
IPAXW,Inflection Point Acquisition Corp. Warrants,$0.26,0.0288,12.457%,0.00,United States,2021,55513,Finance,Business Services
IPDN,Professional Diversity Network Inc. Common Stock,$4.62,-0.12,-2.532%,45905932.00,United States,2013,49556,Technology,EDP Services
IPGP,IPG Photonics Corporation Common Stock,$110.87,0.53,0.48%,5400960982.00,United States,2006,109993,Technology,Semiconductors
IPHA,Innate Pharma S.A. ADS,$3.46,-0.14,-3.889%,277533759.00,France,2019,7978,Health Care,Biotechnology: Pharmaceutical Preparations
IPSC,Century Therapeutics Inc. Common Stock,$4.55,-0.13,-2.778%,268332824.00,United States,2021,118482,Health Care, Medicinal Chemicals and Botanical Products 
IPVI,InterPrivate IV InfraTech Partners Inc. Class A Common Stock,$10.21,-0.05,-0.487%,366921875.00,United States,2021,48221,Industrials,Consumer Electronics/Appliances
IPVIU,InterPrivate IV InfraTech Partners Inc. Units,$10.20,-0.01,-0.098%,0.00,United States,2021,700,Industrials,Consumer Electronics/Appliances
IPW,iPower Inc. Common Stock,$0.968,-0.082,-7.81%,28626066.00,United States,2021,80338,Consumer Discretionary,Catalog/Specialty Distribution
IPWR,Ideal Power Inc. Common Stock,$12.88,0.14,1.099%,76326893.00,United States,2013,24270,Industrials,Industrial Machinery/Components
IPX,IperionX Limited American Depositary Share,$6.25,-0.20,-3.101%,87680306.00,United States,,3255,Consumer Discretionary,Diversified Commercial Services
IQ,iQIYI Inc. American Depositary Shares,$6.40,0.63,10.919%,6056439488.00,China,2018,23737307,Technology,Internet and Information Services
IQMD,Intelligent Medicine Acquisition Corp. Class A Common Stock,$10.32,-0.004,-0.039%,267030000.00,United States,2021,34495,Industrials,Consumer Electronics/Appliances
IQMDU,Intelligent Medicine Acquisition Corp. Unit,$10.33,0.00,0.00%,267288750.00,United States,2021,11357,Industrials,Consumer Electronics/Appliances
IQMDW,Intelligent Medicine Acquisition Corp. Warrant,$0.0293,0.0031,11.832%,0.00,United States,2021,22002,Industrials,Consumer Electronics/Appliances
IRAA,Iris Acquisition Corp Class A Common Stock,$10.19,-0.14,-1.355%,351555000.00,United States,2021,15038,Industrials,Consumer Electronics/Appliances
IRAAU,Iris Acquisition Corp Units,$10.14,0.00,0.00%,0.00,United States,2021,3,Industrials,Consumer Electronics/Appliances
IRBT,iRobot Corporation Common Stock,$45.58,-0.44,-0.956%,1246678635.00,United States,2005,409551,,
IRDM,Iridium Communications Inc Common Stock,$59.16,-0.13,-0.219%,7433012371.00,United States,,329538,Consumer Discretionary,Telecommunications Equipment
IREN,Iris Energy Limited Ordinary Shares,$2.18,0.02,0.926%,119862757.00,Australia,2021,118192,Technology,EDP Services
IRIX,IRIDEX Corporation Common Stock,$2.27,0.09,4.128%,36296442.00,United States,1996,15358,Health Care,Biotechnology: Electromedical & Electrotherapeutic Apparatus
IRMD,iRadimed Corporation Common Stock,$36.58,0.31,0.855%,459676571.00,United States,2014,28631,Health Care,Medical/Dental Instruments
IRON,Disc Medicine Inc. Common Stock,$21.48,-1.03,-4.576%,373872245.00,United States,,28499,Health Care,Biotechnology: Pharmaceutical Preparations
IROQ,IF Bancorp Inc. Common Stock,$17.65,0.34,1.964%,58909099.00,United States,2011,147,Finance,Finance: Consumer Services
IRTC,iRhythm Technologies Inc. Common Stock,$97.23,0.82,0.851%,2927680668.00,United States,2016,135583,Health Care,Medical/Dental Instruments
IRWD,Ironwood Pharmaceuticals Inc. Class A Common Stock,$11.31,0.01,0.088%,1734902845.00,United States,2010,2643573,Health Care,Biotechnology: Pharmaceutical Preparations
ISEE,IVERIC bio Inc. Common Stock,$21.84,0.81,3.852%,2928149996.00,United States,2013,1796202,Health Care,Biotechnology: Pharmaceutical Preparations
ISIG,Insignia Systems Inc. Common Stock,$9.08,-0.02,-0.22%,16312274.00,United States,1991,7007,Consumer Discretionary,Advertising
ISO,IsoPlexis Corporation Common Stock,$1.26,0.015,1.205%,50815706.00,United States,2021,24206,Health Care,Biotechnology: Electromedical & Electrotherapeutic Apparatus
ISPC,iSpecimen Inc. Common Stock,$1.705,0.005,0.294%,15205952.00,United States,2021,15334,Health Care,Precision Instruments
ISPO,Inspirato Incorporated Class A Common Stock,$1.20,-0.07,-5.512%,70648608.00,United States,2021,261025,Consumer Discretionary,Hotels/Resorts
ISPOW,Inspirato Incorporated Warrant,$0.0892,-0.0008,-0.889%,0.00,United States,2021,500,Consumer Discretionary,Hotels/Resorts
ISRG,Intuitive Surgical Inc. Common Stock,$250.55,6.75,2.769%,88540504014.00,United States,2000,1788265,Health Care,Medical/Dental Instruments
ISRLU,Israel Acquisitions Corp Unit,$10.1875,-0.0125,-0.123%,0.00,United States,2023,2311,,
ISSC,Innovative Solutions and Support Inc. Common Stock,$8.65,-0.01,-0.115%,149785242.00,United States,2000,7579,Industrials,Military/Government/Technical
ISTR,Investar Holding Corporation Common Stock,$21.20,0.32,1.533%,209686656.00,United States,2014,18263,Finance,Commercial Banks
ISUN,iSun Inc. Common Stock,$2.05,-0.065,-3.073%,31547559.00,United States,2016,72909,Technology,Semiconductors
ITAQ,Industrial Tech Acquisitions II Inc. Class A Common Stock,$10.28,0.015,0.146%,221662500.00,United States,2022,17901,Industrials,Consumer Electronics/Appliances
ITAQU,Industrial Tech Acquisitions II Inc. Unit,$10.34,0.07,0.682%,0.00,United States,2022,100,Industrials,Consumer Electronics/Appliances
ITAQW,Industrial Tech Acquisitions II Inc. Warrants,$0.08,0.00,0.00%,0.00,United States,2022,50,Industrials,Consumer Electronics/Appliances
ITCI,Intra-Cellular Therapies Inc. Common Stock,$48.77,0.53,1.099%,4618765484.00,United States,,311229,Health Care,Biotechnology: Pharmaceutical Preparations
ITI,Iteris Inc. Common Stock,$3.54,0.13,3.812%,150942488.00,United States,,43798,Telecommunications,Telecommunications Equipment
ITIC,Investors Title Company Common Stock,$156.58,0.59,0.378%,297029442.00,United States,,1552,Finance,Specialty Insurers
ITOS,iTeos Therapeutics Inc. Common Stock,$22.25,-0.37,-1.636%,791550937.00,United States,2020,237357,Health Care, Medicinal Chemicals and Botanical Products 
ITQ,Itiquira Acquisition Corp. Class A Ordinary Shares,$10.14,0.01,0.099%,291525000.00,United States,2021,468847,Finance,Business Services
ITQRU,Itiquira Acquisition Corp. Unit,$10.15,0.00,0.00%,0.00,United States,2021,10,Finance,Business Services
ITRI,Itron Inc. Common Stock,$55.27,-0.31,-0.558%,2496987673.00,United States,1993,203228,Industrials,Electrical Products
ITRM,Iterum Therapeutics plc Ordinary Share,$1.19,-0.01,-0.833%,14557715.00,Ireland,2018,35957,Health Care,Biotechnology: Pharmaceutical Preparations
ITRN,Ituran Location and Control Ltd. Ordinary Shares,$22.00,-0.39,-1.742%,445879038.00,Israel,2005,17035,Technology,Electronic Components
IVA,Inventiva S.A. American Depository Shares,$6.15,0.00,0.00%,259125139.00,France,2020,395,Consumer Discretionary,Other Consumer Services
IVAC,Intevac Inc. Common Stock,$6.79,-0.12,-1.737%,172742054.00,United States,1995,87396,Technology,Industrial Machinery/Components
IVCA,Investcorp India Acquisition Corp. Class A Ordinary Share,$10.40,0.01,0.096%,336375000.00,Cayman Islands,2022,33069,Finance,Business Services
IVCAU,Investcorp India Acquisition Corp. Unit,$10.41,0.01,0.096%,0.00,Cayman Islands,2022,151,Finance,Business Services
IVCAW,Investcorp India Acquisition Corp. Warrant,$0.0681,0.0181,36.20%,0.00,Cayman Islands,2022,12884,Finance,Business Services
IVCB,Investcorp Europe Acquisition Corp I Class A Ordinary Shares,$10.36,0.00,0.00%,446775000.00,Cayman Islands,2022,1184,Finance,Business Services
IVCBU,Investcorp Europe Acquisition Corp I Unit,$10.3401,-0.2399,-2.267%,0.00,Cayman Islands,2021,602,Finance,Business Services
IVCBW,Investcorp Europe Acquisition Corp I Warrant,$0.03,0.0132,78.571%,0.00,Cayman Islands,2022,31096,Finance,Business Services
IVCP,Swiftmerge Acquisition Corp. Class A Ordinary Share,$10.20,0.01,0.098%,286875000.00,United States,2022,115636,Finance,Business Services
IVCPW,Swiftmerge Acquisition Corp. Warrants,$0.0701,0.00,0.00%,0.00,United States,2022,2756,Finance,Business Services
IVDA,Iveda Solutions Inc. Common Stock,$0.7406,-0.0163,-2.154%,11084367.00,United States,,112214,Technology,Security Systems Services
IVDAW,Iveda Solutions Inc. Warrant,$0.4606,-0.0148,-3.113%,0.00,United States,,7420,Technology,Security Systems Services
IVVD,Invivyd Inc. Common Stock,$2.39,-0.03,-1.24%,260467938.00,United States,2021,175027,Health Care,Biotechnology: Pharmaceutical Preparations
IXAQ,IX Acquisition Corp. Class A Ordinary Share,$10.185,0.00,0.00%,292818750.00,United Kingdom,2021,100,Finance,Business Services
IXAQU,IX Acquisition Corp. Unit,$10.1701,-0.0099,-0.097%,0.00,United Kingdom,2021,100,Finance,Business Services
IXHL,Incannex Healthcare Limited American Depositary Shares,$3.44,-0.09,-2.55%,209646490.00,Australia,,5276,,
IZEA,IZEA Worldwide Inc. Common Stock,$0.6499,0.0039,0.604%,40505073.00,United States,,191669,Consumer Discretionary,Advertising
JACK,Jack In The Box Inc. Common Stock,$74.86,0.12,0.161%,1555753471.00,United States,,371791,Consumer Discretionary,Restaurants
JAGX,Jaguar Health Inc. Common Stock,$4.51,-0.45,-9.073%,9093784.00,United States,2015,639141,Health Care,Biotechnology: Pharmaceutical Preparations
JAKK,JAKKS Pacific Inc. Common Stock,$20.87,-0.36,-1.696%,202930155.00,United States,1996,62631,Consumer Discretionary,Recreational Games/Products/Toys
JAMF,Jamf Holding Corp. Common Stock,$19.50,0.43,2.255%,2367053072.00,United States,2020,211449,Technology,Computer Software: Prepackaged Software
JAN,JanOne Inc. Common Stock (NV),$1.44,-0.0001,-0.007%,4536331.00,United States,,21300,Utilities,Environmental Services
JANX,Janux Therapeutics Inc. Common Stock,$22.00,0.36,1.664%,916586638.00,United States,2021,220302,Health Care,Biotechnology: Pharmaceutical Preparations
JAQC,Jupiter Acquisition Corporation Common stock,$10.00,-0.01,-0.10%,202975490.00,United States,2021,209,Industrials,Consumer Electronics/Appliances
JAQCU,Jupiter Acquisition Corporation Units,$10.00,-0.03,-0.299%,0.00,United States,2021,9295,Industrials,Consumer Electronics/Appliances
JAZZ,Jazz Pharmaceuticals plc Common Stock (Ireland),$154.63,-0.71,-0.457%,9736482062.00,Ireland,2007,470861,Health Care,Biotechnology: Pharmaceutical Preparations
JBHT,J.B. Hunt Transport Services Inc. Common Stock,$188.72,0.11,0.058%,19578378960.00,United States,,525412,Industrials,Trucking Freight/Courier Services
JBLU,JetBlue Airways Corporation Common Stock,$8.35,-0.06,-0.713%,2704378077.00,United States,2002,14364916,Consumer Discretionary,Air Freight/Delivery Services
JBSS,John B. Sanfilippo & Son Inc. Common Stock,$81.08,-0.26,-0.32%,934599836.00,United States,1991,42739,Consumer Staples,Specialty Foods
JCSE,JE Cleantech Holdings Limited Ordinary Shares,$0.73,-0.0115,-1.551%,10964600.00,Singapore,2022,15963,Consumer Discretionary,Miscellaneous manufacturing industries
JCTCF,Jewett-Cameron Trading Company Common Shares,$5.645,-0.055,-0.965%,19751285.00,United States,,19146,,
JD,JD.com Inc. American Depositary Shares,$63.11,1.73,2.819%,98798705000.00,China,2014,4803457,Consumer Discretionary,Catalog/Specialty Distribution
JEWL,Adamas One Corp. Common Stock,$2.5299,-0.031,-1.211%,50983172.00,United States,2022,101385,Consumer Discretionary,Consumer Specialties
JFBR,Jeffs' Brands Ltd Ordinary Shares,$1.12,0.0318,2.922%,9043123.00,Israel,2022,94271,Miscellaneous,Diversified Commercial Services
JFBRW,Jeffs' Brands Ltd Warrant,$0.12,-0.0521,-30.273%,0.00,Israel,2022,37688,Miscellaneous,Diversified Commercial Services
JFIN,Jiayin Group Inc. American Depositary Shares,$3.30,0.13,4.101%,176026165.00,China,2019,36395,Finance,Finance: Consumer Services
JFU,9F Inc. American Depositary Shares,$4.73,0.39,8.986%,54921605.00,China,2019,77932,Finance,Finance: Consumer Services
JG,Aurora Mobile Limited American Depositary Shares,$0.7508,0.0008,0.107%,89236040.00,China,2018,35702,Technology,EDP Services
JGGC,Jaguar Global Growth Corporation I Class A Ordinary Shares,$10.31,-0.04,-0.386%,316173337.00,United States,2022,35859,Finance,Business Services
JGGCR,Jaguar Global Growth Corporation I Right,$0.08,0.00,0.00%,0.00,United States,2022,34530,Finance,Business Services
JGGCU,Jaguar Global Growth Corporation I Unit,$10.36,0.05,0.485%,0.00,United States,2022,100,Finance,Business Services
JGGCW,Jaguar Global Growth Corporation I Warrant,$0.0801,0.01,14.265%,0.00,United States,2022,313998,Finance,Business Services
JJSF,J & J Snack Foods Corp. Common Stock,$150.43,-1.50,-0.987%,2892668112.00,United States,1986,68283,Consumer Staples,Specialty Foods
JKHY,Jack Henry & Associates Inc. Common Stock,$181.31,2.39,1.336%,13226461697.00,United States,1985,378516,Technology,Retail: Computer Software & Peripheral Equipment
JMAC,Maxpro Capital Acquisition Corp. Class A Common Stock,$10.42,0.00,0.00%,139914811.00,Taiwan,2021,330,Industrials,Consumer Electronics/Appliances
JMACW,Maxpro Capital Acquisition Corp. Warrants,$0.0399,-0.0001,-0.25%,0.00,Taiwan,2021,61800,Industrials,Consumer Electronics/Appliances
JMSB,John Marshall Bancorp Inc. Common Stock,$25.64,-0.06,-0.233%,361498001.00,United States,,18329,Finance,Major Banks
JNCE,Jounce Therapeutics Inc. Common Stock,$1.13,-0.02,-1.739%,58414488.00,United States,2017,289798,Health Care,Biotechnology: Pharmaceutical Preparations
JOAN,JOANN Inc. Common Stock,$3.43,0.05,1.479%,139899386.00,United States,2021,130633,Consumer Discretionary,Department/Specialty Retail Stores
JOUT,Johnson Outdoors Inc. Class A Common Stock,$65.92,-2.29,-3.357%,675102343.00,United States,,42689,Consumer Discretionary,Recreational Games/Products/Toys
JRSH,Jerash Holdings (US) Inc. Common Stock,$4.225,0.025,0.595%,52367553.00,United States,2018,24582,Consumer Discretionary,Industrial Specialties
JRVR,James River Group Holdings Ltd. Common Shares,$21.72,-0.14,-0.64%,813632091.00,Bermuda,2014,112639,Finance,Property-Casualty Insurers
JSM,Navient Corporation 6% Senior Notes due December 15 2043,$19.19,-0.14,-0.724%,0.00,United States,,12982,Finance,Finance: Consumer Services
JSPR,Jasper Therapeutics Inc. Common Stock,$1.80,-0.05,-2.703%,66732023.00,United States,2020,746310,Health Care,Biotechnology: Pharmaceutical Preparations
JSPRW,Japer Therapeutics Inc. Warrants,$0.125,0.004,3.306%,0.00,United States,2020,3597,Health Care,Biotechnology: Pharmaceutical Preparations
JUGG,Jaws Juggernaut Acquisition Corporation Class A Ordinary Share,$10.11,0.00,0.00%,348795000.00,United States,2021,401212,,
JUGGU,Jaws Juggernaut Acquisition Corporation Unit,$10.15,0.04,0.396%,0.00,United States,2021,300,,
JUGGW,Jaws Juggernaut Acquisition Corporation Warrant,$0.11,0.00,0.00%,0.00,United States,2021,11,,
JUPW,Jupiter Wellness Inc. Common Stock,$0.63,-0.01,-1.563%,14073499.00,United States,2020,197208,Health Care,Biotechnology: Pharmaceutical Preparations
JUPWW,Jupiter Wellness Inc. Warrant,$0.1002,-0.0088,-8.073%,0.00,United States,2020,3667,Health Care,Biotechnology: Pharmaceutical Preparations
JVA,Coffee Holding Co. Inc. Common Stock,$2.31,0.05,2.212%,13186864.00,United States,2005,15049,Consumer Staples,Specialty Foods
JWAC,Jupiter Wellness Acquisition Corp. Class A Common Stock,$10.30,0.00,0.00%,186996500.00,United States,2022,1,Industrials,Consumer Electronics/Appliances
JWACR,Jupiter Wellness Acquisition Corp. Right,$0.08,0.00,0.00%,0.00,United States,2022,1502,Finance,Business Services
JWEL,Jowell Global Ltd. Ordinary Shares,$0.472,-0.034,-6.719%,14862437.00,China,2021,145751,Consumer Discretionary,Other Consumer Services
JXJT,JX Luxventure Limited Common Stock,$0.92,0.00,0.00%,2383995.00,China,2013,35641,Consumer Staples,Apparel
JYNT,The Joint Corp. Common Stock,$18.32,-0.02,-0.109%,266183719.00,United States,2014,96973,,
JZ,Jianzhi Education Technology Group Company Limited American Depositary Shares,$1.84,0.07,3.955%,111421200.00,China,2022,220548,Real Estate,Other Consumer Services
JZXN,Jiuzi Holdings Inc. Ordinary Shares,$0.18,0.0254,16.429%,4627436.00,China,2021,14371732,Consumer Discretionary,Retail-Auto Dealers and Gas Stations
KA,Kineta Inc. Common Stock,$7.83,0.52,7.114%,76431284.00,United States,2016,61809,Health Care,Biotechnology: Pharmaceutical Preparations
KACL,Kairous Acquisition Corp. Limited Ordinary Shares,$10.64,0.00,0.00%,107954962.00,Malaysia,2022,4,Finance,Business Services
KACLR,Kairous Acquisition Corp. Limited Rights,$0.20,0.00,0.00%,0.00,Malaysia,2022,21492,Finance,Business Services
KAII,Kismet Acquisition Two Corp. Class A Ordinary Shares,$10.16,0.01,0.099%,297180000.00,United States,2021,102,Finance,Business Services
KAIIU,Kismet Acquisition Two Corp. Unit,$10.15,0.00,0.00%,0.00,United States,2021,1600,Finance,Business Services
KAIIW,Kismet Acquisition Two Corp. Warrant,$0.02,-0.0293,-59.432%,0.00,United States,2021,6735,Finance,Business Services
KAL,Kalera Public Limited Company Ordinary Shares,$5.94,-0.20,-3.257%,5457541.00,Ireland,,126951,Consumer Staples,Farming/Seeds/Milling
KALA,Kala Pharmaceuticals Inc. Common Stock,$18.97,3.29,20.982%,1063455639.00,United States,2017,3034674,Health Care,Biotechnology: Pharmaceutical Preparations
KALU,Kaiser Aluminum Corporation Common Stock,$89.18,1.10,1.249%,1421584938.00,United States,,45622,Industrials,Aluminum
KALV,KalVista Pharmaceuticals Inc. Common Stock,$8.39,0.40,5.006%,286118691.00,United Kingdom,2015,731111,Health Care,Biotechnology: Pharmaceutical Preparations
KALWW,Kalera Public Limited Company Warrant,$0.03,0.0033,12.36%,0.00,Ireland,,325048,Consumer Staples,Farming/Seeds/Milling
KARO,Karooooo Ltd. Ordinary Shares,$25.22,1.41,5.922%,780586893.00,Singapore,2021,9696,Technology,Computer Software: Prepackaged Software
KAVL,Kaival Brands Innovations Group Inc. Common Stock,$0.8247,-0.0254,-2.988%,46322649.00,United States,,53910,Health Care, Medicinal Chemicals and Botanical Products 
KBAL,Kimball International Inc. Class B Common Stock,$7.15,-0.05,-0.694%,261500568.00,United States,,60182,Consumer Discretionary,Industrial Specialties
KBNT,Kubient Inc. Common Stock,$0.75,0.0353,4.939%,10801875.00,United States,2020,59645,Technology,EDP Services
KBNTW,Kubient Inc. Warrant,$0.0525,-0.047,-47.236%,0.00,United States,2020,30585,Technology,EDP Services
KC,Kingsoft Cloud Holdings Limited American Depositary Shares,$5.13,0.15,3.012%,1301407400.00,China,2020,1961329,Technology,Computer Software: Prepackaged Software
KDNY,Chinook Therapeutics Inc. Common Stock,$24.76,-1.16,-4.475%,1583169751.00,United States,2015,406540,Health Care,Biotechnology: Pharmaceutical Preparations
KDP,Keurig Dr Pepper Inc. Common Stock,$34.93,-0.03,-0.086%,49469658154.00,United States,,5554752,Consumer Staples,Beverages (Production/Distribution)
KE,Kimball Electronics Inc. Common Stock,$25.22,-0.35,-1.369%,623194548.00,United States,,70535,Technology,Industrial Machinery/Components
KELYA,Kelly Services Inc. Class A Common Stock,$17.53,-0.04,-0.228%,665228826.00,United States,,120331,Consumer Discretionary,Diversified Commercial Services
KELYB,Kelly Services Inc. Class B Common Stock,$17.3301,-0.1899,-1.084%,657643016.00,United States,,1007,Consumer Discretionary,Diversified Commercial Services
KEQU,Kewaunee Scientific Corporation Common Stock,$16.48,-0.36,-2.138%,46641696.00,United States,,1633,Industrials,Medical Specialities
KERN,Akerna Corp. Common Stock,$1.78,0.09,5.325%,25024498.00,United States,2018,252820,Health Care,Managed Health Care
KERNW,Akerna Corp Warrant,$0.0249,-0.0001,-0.40%,0.00,United States,2018,3378,Health Care,Managed Health Care
KFFB,Kentucky First Federal Bancorp Common Stock,$6.805,0.00,0.00%,55492699.00,United States,2005,114,Finance,Savings Institutions
KFRC,Kforce Inc. Common Stock,$55.84,0.64,1.159%,1158883593.00,United States,1995,100636,Consumer Discretionary,Diversified Commercial Services
KHC,The Kraft Heinz Company Common Stock,$39.66,-0.29,-0.726%,48580730304.00,United States,,5425458,Consumer Staples,Farming/Seeds/Milling
KIDS,OrthoPediatrics Corp. Common Stock,$45.66,-0.49,-1.062%,1045225890.00,United States,2017,72672,Health Care,Medical/Dental Instruments
KINS,Kingstone Companies Inc. Common Stock,$1.70,0.04,2.41%,18163648.00,United States,,4222,Finance,Specialty Insurers
KINZ,KINS Technology Group Inc. Class A Common Stock,$10.11,0.00,0.00%,79242180.00,United States,2021,2707,Industrials,Consumer Electronics/Appliances
KINZU,KINS Technology Group Inc. Unit,$10.11,-0.03,-0.296%,0.00,United States,2020,4480,Industrials,Consumer Electronics/Appliances
KINZW,KINS Technology Group Inc. Warrant,$0.0711,0.0024,3.493%,0.00,United States,2021,7953,Industrials,Consumer Electronics/Appliances
KIRK,Kirkland's Inc. COMMONSTOCK,$3.64,-0.04,-1.087%,46425900.00,United States,2002,41743,Miscellaneous,Diversified Commercial Services
KITT,Nauticus Robotics Inc. Common stock,$3.47,-0.02,-0.573%,163960175.00,United States,2021,24969,Industrials,Metal Fabrications
KITTW,Nauticus Robotics Inc. Warrant,$0.2696,-0.0003,-0.111%,0.00,United States,2021,1838,Industrials,Metal Fabrications
KLAC,KLA Corporation Common Stock,$428.76,6.14,1.453%,60763149885.00,United States,1980,1632101,Technology,Electronic Components
KLIC,Kulicke and Soffa Industries Inc. Common Stock,$52.80,0.21,0.399%,3003768134.00,Singapore,,379128,Technology,Semiconductors
KLTR,Kaltura Inc. Common Stock,$2.09,0.04,1.951%,278523564.00,United States,2021,40713,Technology,EDP Services
KLXE,KLX Energy Services Holdings Inc. Common Stock,$15.50,0.01,0.065%,190268902.00,United States,,158422,Energy,Oilfield Services/Equipment
KMDA,Kamada Ltd. Ordinary Shares,$4.59,-0.05,-1.078%,205634313.00,Israel,2013,40387,Health Care,Biotechnology: Pharmaceutical Preparations
KMPH,KemPharm Inc. Common Stock,$5.28,-0.22,-4.00%,182185671.00,United States,,174996,Health Care,Biotechnology: Pharmaceutical Preparations
KNBE,KnowBe4 Inc. Class A Common Stock,$24.87,0.02,0.08%,5550897527.00,United States,2021,735578,Technology,Computer Software: Prepackaged Software
KNDI,Kandi Technologies Group Inc Common Stock,$2.83,0.08,2.909%,210078629.00,China,,278472,Consumer Discretionary,Auto Parts:O.E.M.
KNSA,Kiniksa Pharmaceuticals Ltd. Class A Common Stock,$13.77,-0.19,-1.361%,957452363.00,United States,2018,221538,Health Care,Biotechnology: Pharmaceutical Preparations
KNTE,Kinnate Biopharma Inc. Common Stock,$7.14,0.10,1.42%,315335837.00,United States,2020,55200,Health Care,Biotechnology: Pharmaceutical Preparations
KOD,Kodiak Sciences Inc Common Stock,$7.91,-0.15,-1.861%,413765408.00,United States,2018,76536,Health Care,Biotechnology: Pharmaceutical Preparations
KOPN,Kopin Corporation Common Stock,$1.21,0.05,4.31%,115100594.00,United States,1992,1296134,Technology,Industrial Machinery/Components
KOSS,Koss Corporation Common Stock,$6.09,-0.0997,-1.611%,55904952.00,United States,,23216,Consumer Staples,Consumer Electronics/Appliances
KPLT,Katapult Holdings Inc. Common Stock,$0.883,-0.0515,-5.511%,86929799.00,United States,2019,214640,Technology,EDP Services
