Symbol,Name,Last Sale,Net Change,% Change,Market Cap,Country,IPO Year,Volume,Sector,Industry
CTO,CTO Realty Growth Inc. Common Stock,$19.18,0.20,1.054%,438090188.00,United States,1992,87929,Real Estate,Real Estate Investment Trusts
CTO^A,CTO Realty Growth Inc. 6.375% Series A Cumulative Redeemable Preferred Stock,$21.38,-0.02,-0.093%,,United States,,23207,,
CTOS,Custom Truck One Source Inc. Common Stock,$7.04,0.14,2.029%,1735996367.00,Cayman Islands,2017,142598,Consumer Discretionary,Diversified Commercial Services
CTR,ClearBridge MLP and Midstream Total Return Fund Inc. Common Stock,$31.35,0.3604,1.163%,219504674.00,United States,2012,4534,Finance,Investment Managers
CTRA,Coterra Energy Inc. Common Stock,$25.26,0.16,0.637%,19916685286.00,United States,,8121629,Energy,Oil & Gas Production
CTRE,CareTrust REIT Inc. Common Stock,$19.85,0.47,2.425%,1926020529.00,United States,2022,369051,Real Estate,Real Estate Investment Trusts
CTS,CTS Corporation Common Stock,$44.93,-1.79,-3.831%,1432363368.00,United States,,189258,Technology,Industrial Machinery/Components
CTV,Innovid Corp. Common Stock,$2.36,0.02,0.855%,315415366.00,,2021,154566,Consumer Discretionary,Advertising
CTVA,Corteva Inc. Common Stock ,$63.13,0.00,0.00%,45105879960.00,,2019,3726453,Industrials,Major Chemicals
CUBB,Customers Bancorp Inc 5.375% Subordinated Notes Due 2034,$22.10,-0.495,-2.191%,0.00,United States,2019,920,Finance,Major Banks
CUBE,CubeSmart Common Shares,$43.84,0.43,0.991%,9845354234.00,United States,,1243238,Real Estate,Real Estate Investment Trusts
CUBI,Customers Bancorp Inc Common Stock,$26.76,-5.08,-15.955%,870111917.00,United States,,2740715,Finance,Major Banks
CUBI^E,Customers Bancorp Inc Fixed-to-Floating Rate Non-Cumulative Perpetual Preferred Stock Series E,$25.55,0.09,0.353%,,United States,,5585,,
CUBI^F,Customers Bancorp Inc Fixed-to-Floating Rate Non-Cumulative Perpetual Preferred Stock Series F,$25.39,-0.05,-0.197%,,United States,,6048,,
CUK,Carnival Plc ADS ADS,$9.61,-0.20,-2.039%,12484697873.00,United States,,1441632,,
CULP,Culp Inc. Common Stock,$5.31,-0.09,-1.667%,65279876.00,United States,,21767,Consumer Discretionary,Textiles
CURO,CURO Group Holdings Corp. Common Stock,$4.20,0.19,4.738%,170038600.00,,2017,58554,Finance,Diversified Financial Services
CURV,Torrid Holdings Inc. Common Stock,$3.58,-0.01,-0.279%,371101518.00,,2021,64436,Consumer Discretionary,Clothing/Shoe/Accessory Stores
CUZ,Cousins Properties Incorporated Common Stock,$26.26,0.10,0.382%,3976664219.00,United States,,1238107,Real Estate,Real Estate Investment Trusts
CVE,Cenovus Energy Inc Common Stock,$20.16,1.03,5.384%,38684761920.00,Canada,,6363452,,
CVEO,Civeo Corporation (Canada) Common Shares,$34.49,0.43,1.262%,472949678.00,,2014,21161,,
CVI,CVR Energy Inc. Common Stock,$35.50,1.41,4.136%,3568836265.00,United States,2007,460206,Energy,Integrated oil Companies
CVII,Churchill Capital Corp VII Class A Common Stock,$10.05,0.01,0.10%,1733625000.00,,2021,91143,Industrials,Consumer Electronics/Appliances
CVNA,Carvana Co. Class A Common Stock,$6.50,0.07,1.089%,688660343.00,United States,2017,18929686,Consumer Discretionary,Other Specialty Stores
CVS,CVS Health Corporation Common Stock,$87.66,1.91,2.227%,115182339506.00,United States,,9092628,Health Care,Managed Health Care
CVX,Chevron Corporation Common Stock,$187.79,8.71,4.864%,363117982553.00,United States,,14291742,Energy,Integrated oil Companies
CW,Curtiss-Wright Corporation Common Stock,$162.22,-0.28,-0.172%,6214270876.00,United States,,122251,,
CWAN,Clearwater Analytics Holdings Inc. Class A Common Stock,$19.29,0.12,0.626%,3651790131.00,,2021,170686,Technology,Computer Software: Prepackaged Software
CWEN,Clearway Energy Inc. Class C Common Stock,$33.51,0.36,1.086%,3914115377.00,United States,2015,287195,Utilities,Electric Utilities: Central
CWH,Camping World Holdings Inc. Class A Common Stock,$24.29,0.05,0.206%,1023391818.00,United States,2016,1412209,Consumer Discretionary,Other Specialty Stores
CWK,Cushman & Wakefield plc Ordinary Shares,$14.23,0.29,2.08%,3212517215.00,,2018,1727633,Finance,Real Estate
CWT,California Water Service Group Common Stock,$62.29,-0.44,-0.701%,3414986960.00,United States,,179608,Utilities,Water Supply
CX,Cemex S.A.B. de C.V. Sponsored ADR,$5.32,0.24,4.724%,7707502668.00,Mexico,,6606122,Industrials,Building Materials
CXAC,C5 Acquisition Corporation Class A Common Stock,$10.31,0.02,0.194%,370515625.00,,2022,368513,Industrials,Consumer Electronics/Appliances
CXE,MFS High Income Municipal Trust Common Stock,$3.71,-0.03,-0.802%,116960618.00,United States,1989,67843,Finance,Investment Managers
CXH,MFS Investment Grade Municipal Trust Common Stock,$7.55,0.03,0.399%,68782350.00,United States,1989,10901,Finance,Investment Managers
CXM,Sprinklr Inc. Class A Common Stock,$9.74,0.20,2.096%,2542462569.00,,2021,607762,Technology,Computer Software: Prepackaged Software
CXW,CoreCivic Inc. Common Stock,$10.82,-0.18,-1.636%,1244096205.00,United States,,981861,,
CYD,China Yuchai International Limited Common Stock,$9.0892,0.1192,1.329%,371366534.00,Singapore,1994,9842,Industrials,Construction/Ag Equipment/Trucks
CYH,Community Health Systems Inc. Common Stock,$4.68,-0.06,-1.266%,630457678.00,United States,2000,3690430,Health Care,Hospital/Nursing Management
CZOO,Cazoo Group Ltd Class A Ordinary Shares,$0.2027,-0.0032,-1.554%,155859514.00,,,1038411,Consumer Discretionary,Retail-Auto Dealers and Gas Stations
D,Dominion Energy Inc. Common Stock,$62.58,0.26,0.417%,52146362329.00,United States,,2717966,Utilities,Electric Utilities: Central
DAC,Danaos Corporation Common Stock,$57.24,0.00,0.00%,1159090195.00,Greece,2006,134412,Consumer Discretionary,Marine Transportation
DAL,Delta Air Lines Inc. Common Stock,$39.22,-0.16,-0.406%,25147407558.00,United States,,7610953,Consumer Discretionary,Air Freight/Delivery Services
DAN,Dana Incorporated Common Stock ,$17.09,-0.09,-0.524%,2449910717.00,United States,,867537,Consumer Discretionary,Auto Parts:O.E.M.
DAO,Youdao Inc. American Depositary Shares each representing one Class A Ordinary Share,$8.41,0.45,5.653%,1042679840.00,,2019,61697,Real Estate,Other Consumer Services
DAR,Darling Ingredients Inc. Common Stock,$66.90,0.86,1.302%,10722157864.00,United States,1997,877478,Consumer Staples,Farming/Seeds/Milling
DASH,DoorDash Inc. Class A Common Stock,$56.95,-2.58,-4.334%,22108978367.00,,2020,4691417,Industrials,Industrial Machinery/Components
DAVA,Endava plc American Depositary Shares (each representing one Class A Ordinary Share),$87.43,2.31,2.714%,4975682829.00,United Kingdom,2018,219951,Technology,EDP Services
DB,Deutsche Bank AG Common Stock,$13.31,0.24,1.836%,27115132000.00,Germany,,3540441,Finance,Commercial Banks
DBD,Diebold Nixdorf Incorporated Common Stock,$2.34,-0.11,-4.49%,185042667.00,United States,,1210857,Technology,EDP Services
DBI,Designer Brands Inc. Class A Common Stock,$10.44,0.14,1.359%,664322663.00,United States,,1625864,Consumer Discretionary,Clothing/Shoe/Accessory Stores
DBL,DoubleLine Opportunistic Credit Fund Common Shares of Beneficial Interest,$15.51,0.15,0.977%,247296977.00,United States,2012,63364,,
DBRG,DigitalBridge Group Inc.,$13.38,0.39,3.002%,2139399248.00,United States,2014,1203352,Real Estate,Building operators
DBRG^H,DigitalBridge Group Inc. 7.125% Series H ,$20.92,0.57,2.801%,,United States,,20627,,
DBRG^I,DigitalBridge Group Inc. 7.15% Series I ,$21.12,0.36,1.734%,,United States,,17642,,
DBRG^J,DigitalBridge Group Inc. 7.125% Series J ,$21.125,0.35,1.685%,,United States,,20972,,
DCF,BNY Mellon Alcentra Global Credit Income 2024 Target Term Fund Inc. Common Stock,$7.77,0.04,0.517%,116555649.00,,2017,26691,Finance,Finance/Investors Services
DCI,Donaldson Company Inc. Common Stock,$61.52,0.59,0.968%,7486179318.00,United States,,364453,Industrials,Pollution Control Equipment
DCO,Ducommun Incorporated Common Stock,$55.76,0.72,1.308%,674828040.00,United States,,26919,Industrials,Military/Government/Technical
DCP,DCP Midstream  LP Common Units ,$42.02,-0.04,-0.095%,8756823367.00,United States,,589181,Utilities,Natural Gas Distribution
DCP^B,DCP Midstream LP 7.875% Series B Fixed-to-Floating Rate Cumulative Redeemable Perpetual Preferred Units,$25.05,-0.01,-0.04%,,United States,,18419,,
DCP^C,DCP Midstream LP 7.95% Series C Fixed-to-Floating Rate Cumulative Redeemable Perpetual Preferred Units,$25.0511,-0.0639,-0.254%,,United States,,12134,,
DD,DuPont de Nemours Inc. Common Stock,$73.73,0.20,0.272%,36628249136.00,,2017,3134537,Consumer Discretionary,Wholesale Distributors
DDD,3D Systems Corporation Common Stock,$10.13,0.53,5.521%,1328668679.00,United States,,1447883,Technology,Computer peripheral equipment
DDF,Delaware Investments Dividend & Income Fund Inc. Common Stock,$8.29,0.03,0.363%,63096500.00,United States,1993,19079,Finance,Finance/Investors Services
DDL,Dingdong (Cayman) Limited American Depositary Shares (each two representing three Ordinary Shares),$5.20,-0.09,-1.701%,1088707303.00,,2021,704718,Consumer Discretionary,Catalog/Specialty Distribution
DDS,Dillard's Inc. Common Stock,$385.49,5.66,1.49%,6601483098.00,United States,,84607,Consumer Discretionary,Department/Specialty Retail Stores
DDT,Dillard's Capital Trust I,$25.63,0.03,0.117%,0.00,United States,,9965,Consumer Discretionary,Department/Specialty Retail Stores
DE,Deere & Company Common Stock,$421.20,7.56,1.828%,125162551145.00,United States,,1191084,Industrials,Industrial Machinery/Components
DEA,Easterly Government Properties Inc. Common Stock,$15.75,-0.03,-0.19%,1430320831.00,United States,2015,665895,Real Estate,Real Estate Investment Trusts
DECK,Deckers Outdoor Corporation Common Stock,$421.02,0.47,0.112%,11143050452.00,United States,1993,374020,Consumer Discretionary,Shoe Manufacturing
DEI,Douglas Emmett Inc. Common Stock,$15.47,0.15,0.979%,2719454360.00,United States,2006,1397742,Real Estate,Real Estate Investment Trusts
DELL,Dell Technologies Inc. Class C Common Stock ,$40.99,0.47,1.16%,29354098853.00,,2018,1644743,Technology,Computer Manufacturing
DEN,Denbury Inc. Common Stock,$88.79,1.67,1.917%,4421752033.00,,2020,506993,Energy,Oil & Gas Production
DEO,Diageo plc Common Stock,$174.07,-10.29,-5.581%,98614964277.00,United Kingdom,,821112,Consumer Staples,Beverages (Production/Distribution)
DESP,Despegar.com Corp. Ordinary Shares,$6.95,0.28,4.198%,460351966.00,,2017,400564,Consumer Discretionary,Other Consumer Services
DEX,Delaware Enhanced Global Dividend Common Shares of Beneficial Interest,$8.53,0.00,0.00%,90911930.00,United States,2007,17510,Finance,Finance Companies
DFH,Dream Finders Homes Inc. Class A Common Stock,$11.19,-0.01,-0.089%,1037984545.00,United States,2022,82037,,
DFIN,Donnelley Financial Solutions Inc. Common Stock ,$44.66,0.61,1.385%,1299780085.00,,2016,121616,Finance,Investment Managers
DFP,Flaherty & Crumrine Dynamic Preferred and Income Fund Inc. Common Stock,$20.98,0.11,0.527%,430296359.00,,2013,50744,Finance,Investment Managers
DFS,Discover Financial Services Common Stock,$114.69,-0.21,-0.183%,30622230000.00,United States,,3146142,Finance,Finance: Consumer Services
DG,Dollar General Corporation Common Stock,$237.14,-1.28,-0.537%,53018527835.00,United States,2009,3039395,Consumer Discretionary,Department/Specialty Retail Stores
DGX,Quest Diagnostics Incorporated Common Stock,$146.97,2.06,1.422%,16738040878.00,United States,,758714,Health Care,Medical Specialities
DHF,BNY Mellon High Yield Strategies Fund Common Stock,$2.29,0.015,0.659%,166566663.00,United States,1998,436949,Finance,Finance Companies
DHI,D.R. Horton Inc. Common Stock,$96.81,1.33,1.393%,33232797490.00,United States,,2225873,,
DHR,Danaher Corporation Common Stock,$265.86,2.91,1.107%,193625838000.00,United States,,3915918,Health Care,Medical Specialities
DHR^B,Danaher Corporation 5.00% Mandatory Convertible Preferred Stock Series B,$1343.50,-63.42,-4.508%,,United States,,9181,,
DHT,DHT Holdings Inc.,$8.21,-0.01,-0.122%,1335383913.00,Jersey,2005,1158868,Consumer Discretionary,Marine Transportation
DHX,DHI Group Inc. Common Stock,$5.92,0.15,2.60%,282861199.00,United States,2007,86908,Technology,Computer Software: Prepackaged Software
DIAX,Nuveen Dow 30SM Dynamic Overwrite Fund Common Shares of Beneficial Interest,$15.60,0.08,0.515%,567323843.00,,2014,80927,Finance,Finance Companies
DIN,Dine Brands Global Inc. Common Stock,$76.52,0.14,0.183%,1199717366.00,United States,,183628,Consumer Discretionary,Restaurants
DINO,HF Sinclair Corporation Common Stock,$59.18,1.69,2.94%,11879233120.00,United States,1960,1845686,Energy,Integrated oil Companies
DIS,Walt Disney Company (The) Common Stock,$109.70,1.58,1.461%,200048041084.00,United States,,9196582,Consumer Discretionary,Movies/Entertainment
DK,Delek US Holdings Inc. Common Stock,$27.47,0.67,2.50%,1914447921.00,United States,2017,1110939,Energy,Integrated oil Companies
DKL,Delek Logistics Partners L.P. Common Units representing Limited Partner Interests,$50.52,1.34,2.725%,2197224883.00,United States,2012,28074,Energy,Oil & Gas Production
DKS,Dick's Sporting Goods Inc Common Stock,$125.99,0.66,0.527%,10509014381.00,United States,2002,656524,Consumer Discretionary,Other Specialty Stores
DLB,Dolby Laboratories Common Stock,$79.71,0.52,0.657%,7613949816.00,United States,2005,315025,Technology,EDP Services
DLNG,Dynagas LNG Partners LP Common Units,$2.92,-0.01,-0.341%,107462561.00,Greece,,37446,,
DLNG^A,Dynagas LNG Partners LP 9.00% Series A Cumulative Redeemable Preferred Units,$24.00,0.10,0.418%,,Greece,,9705,,
DLNG^B,Dynagas LNG Partners LP 8.75% Series B Fixed to Floating Rate Cumulative Redeemable Perpetual Preferred Units liquidation preference $25.00 per Uni,$24.01,-0.66,-2.675%,,Greece,,3402,,
DLR,Digital Realty Trust Inc. Common Stock,$109.31,2.12,1.978%,31429059880.00,United States,2004,1365093,Real Estate,Real Estate Investment Trusts
DLR^J,Digital Realty Trust Inc. 5.250% Series J Cumulative Redeemable Preferred Stock,$23.41,0.17,0.731%,,United States,,10002,,
DLR^K,Digital Realty Trust Inc. 5.850% Series K Cumulative Redeemable Preferred Stock par value $0.01 per share,$25.11,0.22,0.884%,,United States,,20597,,
DLR^L,Digital Realty Trust Inc. 5.200% Series L Cumulative Redeemable Preferred Stock,$23.11,0.05,0.217%,,United States,,18136,,
DLX,Deluxe Corporation Common Stock,$19.77,-0.01,-0.051%,852800875.00,United States,,134789,Consumer Discretionary,Advertising
DLY,DoubleLine Yield Opportunities Fund Common Shares of Beneficial Interest,$14.57,0.24,1.675%,698570000.00,,2020,111182,Finance,Investment Managers
DM,Desktop Metal Inc. Class A Common Stock,$1.77,-0.01,-0.562%,562111476.00,,2019,2440663,Technology,Computer peripheral equipment
DMA,Destra Multi-Alternative Fund Common Stock,$6.80,0.00,0.00%,60950025.00,,2022,50290,Finance,Trusts Except Educational Religious and Charitable
DMB,BNY Mellon Municipal Bond Infrastructure Fund Inc. Common Stock,$11.16,-0.15,-1.326%,205370884.00,,2013,76909,Finance,Trusts Except Educational Religious and Charitable
DMO,Western Asset Mortgage Opportunity Fund Inc. Common Stock,$10.90,0.02,0.184%,124596756.00,United States,2010,40811,Finance,Trusts Except Educational Religious and Charitable
DMS,Digital Media Solutions Inc. Class A Ordinary Shares,$1.39,-0.0027,-0.194%,55497590.00,United States,2018,58755,Consumer Discretionary,Advertising
DMYS,dMY Technology Group Inc. VI Class A Common Stock,$10.11,0.03,0.298%,305195625.00,,2021,209531,Industrials,Consumer Electronics/Appliances
DNA,Ginkgo Bioworks Holdings Inc. Class A Common Stock,$1.75,-0.01,-0.568%,3467386549.00,United States,2021,16441427,Health Care,Biotechnology: Biological Products (No Diagnostic Substances)
DNB,Dun & Bradstreet Holdings Inc. Common Stock,$13.74,0.07,0.512%,5986949147.00,United States,2020,1139798,Technology,Internet and Information Services
DNMR,Danimer Scientific Inc. Common Stock,$2.16,-0.07,-3.139%,218999534.00,,2020,660499,Industrials,Plastic Products
DNOW,NOW Inc. Common Stock,$13.23,0.00,0.00%,1461117906.00,,2014,320607,Industrials,Metal Fabrications
DNP,DNP Select Income Fund Inc. Common Stock,$11.71,-0.02,-0.171%,4155350493.00,United States,1987,443073,Finance,Investment Managers
DNZ,D and Z Media Acquisition Corp. Class A Common Stock,$10.16,0.00,0.00%,365125000.00,,2021,4505,Industrials,Consumer Electronics/Appliances
DO,Diamond Offshore Drilling Inc. Common Stock,$11.68,0.00,0.00%,1184131201.00,United States,2022,592532,Energy,Oil & Gas Production
DOC,Physicians Realty Trust Common Shares of Beneficial Interest,$15.60,0.18,1.167%,3560869416.00,United States,2013,1237947,Real Estate,Real Estate Investment Trusts
DOCN,DigitalOcean Holdings Inc. Common Stock,$28.84,0.88,3.147%,2777208306.00,United States,2021,743953,Technology,Retail: Computer Software & Peripheral Equipment
DOCS,Doximity Inc. Class A Common Stock,$33.43,0.46,1.395%,6434881429.00,,2021,1947153,Technology,Retail: Computer Software & Peripheral Equipment
DOLE,Dole plc Ordinary Shares,$10.48,-0.18,-1.689%,994541520.00,,2021,335128,,
DOMA,Doma Holdings Inc. Common Stock,$0.5905,0.0253,4.476%,193976854.00,,2021,581446,Finance,Real Estate
DOOR,Masonite International Corporation Ordinary Shares (Canada),$88.65,1.28,1.465%,1974771035.00,Canada,,105448,,
DOUG,Douglas Elliman Inc. Common Stock,$4.72,0.08,1.724%,383491329.00,,2021,187023,Real Estate,Building operators
DOV,Dover Corporation Common Stock,$143.50,1.65,1.163%,20140791825.00,United States,,696962,Industrials,Industrial Machinery/Components
DOW,Dow Inc. Common Stock ,$58.12,0.23,0.397%,40902488714.00,,2019,8002560,Industrials,Industrial Specialties
DPG,Duff & Phelps Utility and Infrastructure Fund Inc.,$13.86,0.13,0.947%,528274981.00,United States,2011,61300,Finance,Trusts Except Educational Religious and Charitable
DPZ,Domino's Pizza Inc Common Stock,$354.04,3.40,0.97%,12532796141.00,United States,2004,758994,Consumer Discretionary,Food Distributors
DQ,DAQO New Energy Corp. American Depositary Shares each representing five ordinary shares,$46.76,0.33,0.711%,3506052829.00,China,2010,403366,Technology,Semiconductors
DRD,DRDGOLD Limited American Depositary Shares,$8.36,-0.25,-2.904%,717268304.00,South Africa,,189554,Basic Materials,Precious Metals
DRH,Diamondrock Hospitality Company Common Stock,$9.53,0.19,2.034%,1995342130.00,United States,2005,1683247,Real Estate,Real Estate Investment Trusts
DRH^A,Diamondrock Hospitality Company 8.250% Series A Cumulative Redeemable Preferred Stock,$25.53,0.00,0.00%,,United States,,10336,,
DRI,Darden Restaurants Inc. Common Stock,$149.30,1.52,1.029%,18170600693.00,United States,,802488,Consumer Discretionary,Restaurants
DRQ,Dril-Quip Inc. Common Stock,$30.02,0.55,1.866%,1018270175.00,United States,1997,194000,Industrials,Metal Fabrications
DSAQ,Direct Selling Acquisition Corp. Class A Common Stock,$10.384,0.014,0.135%,298540000.00,,2021,2555,Industrials,Consumer Electronics/Appliances
DSL,DoubleLine Income Solutions Fund Common Shares of Beneficial Interests,$12.43,0.24,1.969%,1267820572.00,,2013,545937,Finance,Trusts Except Educational Religious and Charitable
DSM,BNY Mellon Strategic Municipal Bond Fund Inc. Common Stock,$6.08,0.02,0.33%,300526441.00,United States,1989,140387,Finance,Investment Managers
DSU,Blackrock Debt Strategies Fund Inc. Common Stock,$9.62,0.05,0.522%,448391201.00,United States,1998,123824,Finance,Finance Companies
DSX,Diana Shipping inc. common stock,$3.73,0.11,3.039%,321525399.00,Greece,2005,684164,Consumer Discretionary,Marine Transportation
DSX^B,Diana Shipping Inc. Perpetual Preferred Shares Series B (Marshall Islands),$25.55,0.3273,1.298%,,Greece,,1269,,
DT,Dynatrace Inc. Common Stock,$38.38,1.49,4.039%,11047797871.00,United States,2019,1429428,Technology,EDP Services
DTB,DTE Energy Company 2020 Series G 4.375% Junior Subordinated Debentures due 2080,$20.74,-0.2564,-1.221%,0.00,United States,2020,11752,Utilities,Electric Utilities: Central
DTC,Solo Brands Inc. Class A Common Stock,$4.30,0.17,4.116%,273443308.00,,2021,101987,Miscellaneous,Diversified Commercial Services
DTE,DTE Energy Company Common Stock,$113.35,-0.06,-0.053%,21960654680.00,United States,,723394,Utilities,Electric Utilities: Central
DTF,DTF Tax-Free Income 2028 Term Fund Inc. Common Stock,$11.25,0.00,0.00%,79082629.00,United States,1991,9886,Finance,Investment Managers
DTG,DTE Energy Company 2021 Series E 4.375% Junior Subordinated Debentures,$20.38,0.15,0.741%,0.00,United States,2021,15912,Utilities,Electric Utilities: Central
DTLA^,Brookfield DTLA Inc. 7.625% Series A Cumulative Redeemable Preferred Stock,$3.85,0.12,3.217%,,,,3115,,
DTM,DT Midstream Inc. Common Stock ,$53.65,0.46,0.865%,5190690238.00,,2021,418592,Utilities,Oil & Gas Production
DTW,DTE Energy Company 2017 Series E 5.25% Junior Subordinated Debentures due 2077,$24.41,0.10,0.411%,0.00,United States,2017,20440,Utilities,Electric Utilities: Central
DUK,Duke Energy Corporation (Holding Company) Common Stock,$101.34,-0.08,-0.079%,78038161314.00,United States,,2093494,Utilities,Power Generation
DUK^A,Duke Energy Corporation Depositary Shares each representing a 1/1000th interest in a share of 5.75% Series A Cumulative Redeemable Perpetual Preferred Stock,$25.60,0.01,0.039%,,United States,,74338,,
DUKB,Duke Energy Corporation 5.625% Junior Subordinated Debentures due 2078,$25.06,-0.02,-0.08%,0.00,United States,2018,29956,Utilities,Power Generation
DV,DoubleVerify Holdings Inc. Common Stock,$27.57,2.13,8.373%,4545606149.00,,2021,5162086,Technology,Computer Software: Prepackaged Software
DVA,DaVita Inc. Common Stock,$79.61,2.13,2.749%,7172861000.00,United States,,554975,Health Care,Medical/Nursing Services
DVN,Devon Energy Corporation Common Stock,$65.72,1.55,2.415%,42961164000.00,United States,1985,6339392,Energy,Oil & Gas Production
DX,Dynex Capital Inc. Common Stock,$14.84,0.46,3.199%,687835929.00,United States,,826173,Real Estate,Real Estate Investment Trusts
DX^C,Dynex Capital Inc. 6.900% Series C Fixed-to-Floating Rate Cumulative Redeemable Preferred Stock,$22.98,0.03,0.131%,,United States,,13549,,
DXC,DXC Technology Company Common Stock ,$28.56,0.68,2.439%,6570662769.00,,,878485,Technology,EDP Services
DY,Dycom Industries Inc. Common Stock,$91.86,0.31,0.339%,2715074696.00,United States,,510571,Industrials,Water Sewer Pipeline Comm & Power Line Construction
E,ENI S.p.A. Common Stock,$31.19,0.37,1.201%,52171359264.00,Italy,,445970,Energy,Oil & Gas Production
EAF,GrafTech International Ltd. Common Stock,$5.95,-0.04,-0.668%,1526754185.00,United States,2018,2928467,Consumer Discretionary,Metal Fabrications
EAI,Entergy Arkansas LLC First Mortgage Bonds 4.875% Series Due September 1 2066,$23.23,0.16,0.694%,0.00,United States,2016,19107,,
EARN,Ellington Residential Mortgage REIT Common Shares of Beneficial Interest,$7.96,0.00,0.00%,105432572.00,United States,2013,94664,Real Estate,Real Estate Investment Trusts
EAT,Brinker International Inc. Common Stock,$38.97,0.88,2.31%,1715912543.00,United States,,777209,Consumer Discretionary,Restaurants
EB,Eventbrite Inc. Class A Common Stock,$8.27,0.05,0.608%,816167598.00,United States,2018,711081,Technology,EDP Services
EBF,Ennis Inc. Common Stock,$20.86,-0.03,-0.144%,538947137.00,United States,,52121,Consumer Discretionary,Office Equipment/Supplies/Services
EBR,Centrais Electricas Brasileiras S A American Depositary Shares (Each representing one Common Share),$8.43,0.03,0.357%,19361966651.00,,2016,568394,Utilities,Electric Utilities: Central
EBS,Emergent Biosolutions Inc. Common Stock,$13.12,-0.34,-2.526%,654533420.00,United States,2006,632278,Health Care,Biotechnology: Pharmaceutical Preparations
EC,Ecopetrol S.A. American Depositary Shares,$11.96,0.18,1.528%,24587783419.00,Colombia,,1128633,Energy,Oil & Gas Production
ECAT,BlackRock ESG Capital Allocation Trust Common Shares of Beneficial Interest,$14.80,0.11,0.749%,1545518534.00,,2021,490975,Finance,Trusts Except Educational Religious and Charitable
ECC           ,Eagle Point Credit Company Inc. Common Stock,$10.59,0.07,0.665%,497712876.00,United States,2014,254506,Finance,Trusts Except Educational Religious and Charitable
ECC^D,Eagle Point Credit Company Inc. 6.75% Series D Preferred Stock,$20.8515,-0.0585,-0.28%,,United States,,8851,,
ECCC,Eagle Point Credit Company Inc. 6.50% Series C Term Preferred Stock due 2031,$21.79,0.10,0.461%,0.00,United States,,5888,Finance,Trusts Except Educational Religious and Charitable
ECCV,Eagle Point Credit Company Inc. 5.375% Notes due 2029,$22.08,0.05,0.227%,0.00,United States,2022,666,Finance,Trusts Except Educational Religious and Charitable
ECCW,Eagle Point Credit Company Inc. 6.75% Notes due 2031,$23.14,0.23,1.004%,0.00,United States,2021,2610,Finance,Trusts Except Educational Religious and Charitable
ECCX,Eagle Point Credit Company Inc. 6.6875% Notes due 2028,$24.7754,0.0154,0.062%,0.00,United States,2022,914,Finance,Trusts Except Educational Religious and Charitable
ECL,Ecolab Inc. Common Stock,$151.85,-0.55,-0.361%,43251140911.00,United States,,968175,Consumer Discretionary,Package Goods/Cosmetics
ECVT,Ecovyst Inc. Common Stock,$10.57,0.10,0.955%,1376775817.00,United States,2017,601793,Industrials,Major Chemicals
ED,Consolidated Edison Inc. Common Stock,$94.88,0.43,0.455%,33669387018.00,United States,,1276146,Utilities,Power Generation
EDD,Morgan Stanley Emerging Markets Domestic Debt Fund Inc. Morgan Stanley Emerging Markets Domestic Debt Fund Inc. Common Stock,$4.68,0.02,0.429%,308821767.00,United States,2007,93787,Finance,Finance Companies
EDF,Virtus Stone Harbor Emerging Markets Income Fund Common Shares of Beneficial Interest,$5.45,-0.02,-0.366%,92965168.00,United States,2010,83949,Finance,Investment Managers
EDI,Virtus Stone Harbor Emerging Markets Total Income Fund Common Shares of Beneficial Interest,$6.38,-0.04,-0.623%,63689798.00,United States,2012,79502,Finance,Finance Companies
