Symbol,Name,Last Sale,Net Change,% Change,Market Cap,Country,IPO Year,Volume,Sector,Industry
PM,Philip Morris International Inc Common Stock,$104.32,0.90,0.87%,161717104458.00,United States,,4156156,Health Care, Medicinal Chemicals and Botanical Products 
PMF,PIMCO Municipal Income Fund Common Stock,$10.84,-0.11,-1.005%,283193233.00,United States,2001,16738,Finance,Finance/Investors Services
PML,Pimco Municipal Income Fund II Common Shares of Beneficial Interest,$9.605,0.015,0.156%,616976359.00,United States,2002,200243,Finance,Investment Managers
PMM,Putnam Managed Municipal Income Trust Common Stock,$7.20,0.09,1.266%,350919425.00,United States,1989,202347,Finance,Investment Managers
PMO,Putnam Municipal Opportunities Trust Common Stock,$12.07,0.00,0.00%,410157514.00,United States,1993,74528,Finance,Finance Companies
PMT,PennyMac Mortgage Investment Trust Common Shares of Beneficial Interest,$15.11,0.37,2.51%,1343709197.00,United States,2009,517419,Real Estate,Real Estate Investment Trusts
PMT^A,PennyMac Mortgage Investment Trust 8.125% Series A Fixed-to-Floating Rate Cumulative Redeemable Preferred Shares of Beneficial Interest,$24.2861,0.2311,0.961%,,United States,,3707,,
PMT^B,PennyMac Mortgage Investment Trust 8.00% Series B Fixed-to-Floating Rate Cumulative Redeemable Preferred Shares of Beneficial Interest,$23.8381,0.0881,0.371%,,United States,,13004,,
PMT^C,PennyMac Mortgage Investment Trust 6.75% Series C Cumulative Redeemable Preferred Shares of Beneficial Interest,$19.3602,0.0454,0.235%,,United States,,23826,,
PMX,PIMCO Municipal Income Fund III Common Shares of Beneficial Interest,$8.61,-0.02,-0.232%,287217365.00,United States,2002,46594,Finance,Trusts Except Educational Religious and Charitable
PNC,PNC Financial Services Group Inc. (The) Common Stock,$161.93,1.75,1.093%,64933930000.00,United States,,1397194,Finance,Major Banks
PNF,PIMCO New York Municipal Income Fund Common Stock,$9.70,-0.13,-1.322%,76241340.00,United States,2001,3534,Finance,Finance Companies
PNI,Pimco New York Municipal Income Fund II Common Shares of Beneficial Interest,$8.32,0.09,1.094%,93260095.00,United States,2002,25368,Finance,Trusts Except Educational Religious and Charitable
PNM,PNM Resources Inc. (Holding Co.) Common Stock,$49.32,0.04,0.081%,4233375986.00,United States,,331353,Utilities,Electric Utilities: Central
PNNT,PennantPark Investment Corporation Common Stock,$5.89,0.00,0.00%,384172305.00,United States,2022,174704,Finance,Finance/Investors Services
PNR,Pentair plc. Ordinary Share,$50.59,-0.15,-0.296%,8321971729.00,Switzerland,,1277835,Industrials,Fluid Controls
PNTM,Pontem Corporation Class A Ordinary Shares,$10.25,0.01,0.098%,884062500.00,,2021,3653,Finance,Business Services
PNW,Pinnacle West Capital Corporation Common Stock,$74.02,0.27,0.366%,8374637826.00,United States,,766647,Utilities,Electric Utilities: Central
POR,Portland General Electric Co Common Stock,$47.17,0.28,0.597%,4758882432.00,United States,,510027,Utilities,Electric Utilities: Central
PORT,Southport Acquisition Corporation Class A Common Stock,$10.24,0.005,0.049%,294400000.00,,2022,2202,Industrials,Consumer Electronics/Appliances
POST,Post Holdings Inc. Common Stock,$91.29,0.97,1.074%,5362887102.00,United States,2012,511199,Consumer Discretionary,Food Distributors
PPG,PPG Industries Inc. Common Stock,$127.70,-0.45,-0.351%,30012998214.00,United States,,2149869,Consumer Discretionary,Paints/Coatings
PPL,PPL Corporation Common Stock,$29.68,0.18,0.61%,21853926669.00,United States,,4778817,Utilities,Electric Utilities: Central
PPT,Putnam Premier Income Trust Common Stock,$3.76,0.00,0.00%,374226269.00,United States,1988,208120,Finance,Finance Companies
PR,Permian Resources Corporation Class A Common Stock,$11.00,0.42,3.97%,3173505929.00,United States,2022,9185996,Energy,Oil & Gas Production
PRA,ProAssurance Corporation Common Stock,$19.06,-0.01,-0.052%,1028545377.00,United States,,139175,Finance,Property-Casualty Insurers
PRBM,Parabellum Acquisition Corp. Class A Common Stock,$10.4107,-0.0093,-0.089%,187067266.00,,2021,140,Industrials,Consumer Electronics/Appliances
PRE^J,PartnerRe Ltd. 4.875% Fixed Rate Non-Cumulative Redeemable Preferred Shares Series J,$21.8791,0.1691,0.779%,,Bermuda,,5233,,
PRG,PROG Holdings Inc. Common Stock,$20.49,0.35,1.738%,1025168794.00,United States,,475800,Consumer Discretionary,Diversified Commercial Services
PRGO,Perrigo Company plc Ordinary Shares,$36.64,-0.19,-0.516%,4933200293.00,United States,,865450,Health Care,Biotechnology: Pharmaceutical Preparations
PRH,Prudential Financial Inc. 5.950% Junior Subordinated Notes due 2062,$25.4299,0.0999,0.394%,0.00,United States,2022,45618,Finance,Life Insurance
PRI,Primerica Inc. Common Stock,$158.08,1.93,1.236%,5832862714.00,United States,2010,114395,Finance,Life Insurance
PRIF^D,Priority Income Fund Inc. 7.00% Series D Term Preferred Stock due 2029,$22.4374,-0.1046,-0.464%,,,,3621,,
PRIF^F,Priority Income Fund Inc. 6.625% Series F Term Preferred Stock due 2027,$23.61,0.41,1.767%,,,,1682,,
PRIF^G,Priority Income Fund Inc. 6.25% Series G Preferred Stock Due 2026,$23.65,0.304,1.302%,,,,1075,,
PRIF^H,Priority Income Fund Inc. 6.00% Series H Term Preferred Stock due 2026,$22.69,-0.07,-0.308%,,,,919,,
PRIF^I,Priority Income Fund Inc. 6.125% Series I Term Preferred Stock due 2028,$22.4572,0.00,0.00%,,,,40,,
PRIF^J,Priority Income Fund Inc. 6.000% Series J Term Preferred Stock due 2028,$21.64,0.14,0.651%,,,,1447,,
PRIF^K,Priority Income Fund Inc. 7.000% Series K Cumulative Preferred Stock,$21.12,-0.134,-0.63%,,,,8773,,
PRIF^L,Priority Income Fund Inc. 6.375% Series L Term Preferred Stock Due 2029,$22.7449,-0.0049,-0.022%,,,,4243,,
PRLB,Proto Labs Inc. Common stock,$28.62,0.49,1.742%,776085420.00,United States,2012,107658,Industrials,Office Equipment/Supplies/Services
PRM,Perimeter Solutions SA Ordinary Shares,$9.24,0.07,0.763%,1453095983.00,,2021,461339,Consumer Discretionary,Newspapers/Magazines
PRMW,Primo Water Corporation Common Stock,$15.55,0.06,0.387%,2484709651.00,Canada,,667942,Consumer Staples,Farming/Seeds/Milling
PRO,PROS Holdings Inc. Common Stock,$24.78,0.99,4.161%,1123081762.00,United States,2007,204976,Technology,EDP Services
PRPC,CC Neuberger Principal Holdings III Class A Ordinary Shares,$10.17,0.01,0.098%,562528125.00,,2021,269278,Finance,Business Services
PRS,Prudential Financial Inc. 5.625% Junior Subordinated Notes due 2058,$25.41,0.07,0.276%,865504417.00,United States,2018,19097,Finance,Life Insurance
PRT,PermRock Royalty Trust Trust Units,$7.72,-0.08,-1.026%,93919451.00,United States,2018,39848,Energy,Oil & Gas Production
PRU,Prudential Financial Inc. Common Stock,$102.83,1.30,1.28%,37841440000.00,United States,2001,1208340,Finance,Life Insurance
PSA,Public Storage Common Stock,$297.39,5.10,1.745%,52233100207.00,United States,,593569,Real Estate,Real Estate Investment Trusts
PSA^F,Public Storage Depositary Shares Each Representing 1/1000 of a 5.15% Cumulative Preferred Share of Beneficial Interest Series F par value $0.01 per share,$24.10,0.13,0.542%,,United States,,25580,,
PSA^G,Public Storage Depositary Shares Each Representing 1/1000 of a 5.05% Cumulative Preferred Share of Beneficial Interest Series G,$23.85,-0.08,-0.334%,,United States,,59530,,
PSA^H,Public Storage Depositary Shares Each Representing 1/1000 of a  5.60% Cumulative Preferred  Share of Beneficial Interest Series H,$25.44,0.135,0.533%,,United States,,31243,,
PSA^I,Public Storage Depositary Shares Each Representing 1/1000 of a 4.875% Cumulative Preferred Share of Beneficial Interest Series I par value $0.01 per share,$22.41,-0.07,-0.311%,,United States,,13929,,
PSA^J,Public Storage Depositary Shares Each Representing 1/1000 of a 4.700% Cumulative Preferred Share of Beneficial Interest Series J par value $0.01 per share,$21.80,0.07,0.322%,,United States,,616099,,
PSA^K,Public Storage Depositary Shares Each Representing 1/1000 of a 4.75% Cumulative Preferred Share of Beneficial Interest Series K,$21.91,0.03,0.137%,,United States,,377852,,
PSA^L,Public Storage Depositary Shares Each Representing 1/1000 of a 4.625% Cumulative Preferred Share of Beneficial Interest Series L par value $0.01 per share,$21.17,0.05,0.237%,,United States,,142457,,
PSA^M,Public Storage Depositary Shares Each Representing 1/1000 of a 4.125% Cumulative Preferred Share of Beneficial Interest Series M,$19.06,-0.01,-0.052%,,United States,,11693,,
PSA^N,Public Storage Depositary Shares Each Representing 1/1000 of a 3.875% Cumulative Preferred Share of Beneficial Interest Series N,$18.04,-0.01,-0.055%,,United States,,17233,,
PSA^O,Public Storage Depositary Shares Each Representing 1/1000 of a 3.900% Cumulative Preferred Share of Beneficial Interest Series O,$18.15,0.05,0.276%,,United States,,22464,,
PSA^P,Public Storage Depositary Shares Each Representing 1/1000 of a 4.000% Cumulative Preferred Share of Bene cial Interest Series P,$18.95,0.01,0.053%,,United States,,38169,,
PSA^Q,Public Storage Depositary Shares Each Representing 1/1000 of a 3.950% Cumulative Preferred Share of Beneficial Interest Series Q par value $0.01 per share,$18.245,0.035,0.192%,,United States,,11019,,
PSA^R,Public Storage Depositary Shares Each Representing 1/1000 of a 4.00% Cumulative Preferred Share of Bene cial Interest Series R,$18.60,-0.03,-0.161%,,United States,,40074,,
PSA^S,Public Storage Depositary Shares Each Representing 1/1000 of a 4.100% Cumulative Preferred Share of Beneficial Interest Series S,$18.83,0.02,0.106%,,United States,,17672,,
PSEC^A,Prospect Capital Corporation 5.35% Series A Fixed Rate Cumulative Perpetual Preferred Stock,$16.76,0.08,0.48%,,United States,,21528,,
PSF,Cohen & Steers Select Preferred and Income Fund Inc. Common Stock,$20.94,0.15,0.722%,251837465.00,,2010,26139,Finance,Investment Managers
PSFE,Paysafe Limited Common Shares,$20.60,0.44,2.183%,1248641458.00,,2021,218267,Consumer Discretionary,Business Services
PSN,Parsons Corporation Common Stock,$43.24,0.01,0.023%,4475466218.00,,2019,456394,Technology,EDP Services
PSO,Pearson Plc Common Stock,$11.43,-0.04,-0.349%,8180830945.00,United Kingdom,,408089,Consumer Discretionary,Books
PSPC,Post Holdings Partnering Corporation Series A Common Stock,$10.0201,-0.0049,-0.049%,443038722.00,,2021,71004,Industrials,Consumer Electronics/Appliances
PSTG,Pure Storage Inc. Class A Common Stock,$28.24,0.63,2.282%,8545018276.00,,2015,4521180,Technology,Electronic Components
PSTL,Postal Realty Trust Inc. Class A Common Stock,$15.30,0.03,0.196%,291338301.00,,2019,52162,Real Estate,Real Estate Investment Trusts
PSX,Phillips 66 Common Stock,$111.49,2.64,2.425%,52693765427.00,United States,,2720748,Energy,Integrated oil Companies
PTA,Cohen & Steers Tax-Advantaged Preferred Securities and Income Fund Common Shares of Beneficial Interest,$19.65,0.11,0.563%,1086123430.00,,2020,121616,Finance,Trusts Except Educational Religious and Charitable
PTY,Pimco Corporate & Income Opportunity Fund,$13.66,-0.01,-0.073%,1659252880.00,United States,2002,623283,Finance,Investment Managers
PUK,Prudential Public Limited Company Common Stock,$34.34,1.05,3.154%,47211823255.00,United Kingdom,,714062,Finance,Life Insurance
PUMP,ProPetro Holding Corp. Common Stock,$9.65,0.00,0.00%,1105446920.00,United States,2017,974735,Energy,Oilfield Services/Equipment
PVH,PVH Corp. Common Stock,$89.12,0.12,0.135%,6359579138.00,United States,,472327,,
PVL,Permianville Royalty Trust Trust Units ,$3.06,0.01,0.328%,100980000.00,United States,2011,245566,Energy,Oil & Gas Production
PWR,Quanta Services Inc. Common Stock,$150.06,1.17,0.786%,21443747469.00,United States,,840380,Industrials,Engineering & Construction
PWSC,PowerSchool Holdings Inc. Class A Common Stock,$23.42,0.10,0.429%,4670458533.00,United States,2021,308151,Technology,Computer Software: Prepackaged Software
PX,P10 Inc. Class A Common Stock,$11.26,0.00,0.00%,1318024189.00,United States,2021,49996,Finance,Investment Managers
PXD,Pioneer Natural Resources Company Common Stock,$237.00,0.78,0.33%,56310899721.00,United States,,2290659,Energy,Oil & Gas Production
PYN,PIMCO New York Municipal Income Fund III Common Shares of Beneficial Interest,$6.94,0.03,0.434%,39860681.00,United States,2002,3531,Finance,Investment Managers
PZC,PIMCO California Municipal Income Fund III Common Shares of Beneficial Interest,$8.12,0.03,0.371%,182311263.00,United States,2002,64270,Finance,Investment Managers
QBTS,D-Wave Quantum Inc. Common Shares,$1.22,0.01,0.826%,136037314.00,,2022,633430,Technology,Retail: Computer Software & Peripheral Equipment
QD,Qudian Inc. American Depositary Shares each representing one Class A Ordinary Share,$1.17,0.04,3.54%,295395520.00,China,2017,1707306,Technology,Computer Software: Prepackaged Software
QFTA,Quantum FinTech Acquisition Corporation Common Stock,$10.13,0.00,0.00%,254832813.00,,2021,8110,Industrials,Consumer Electronics/Appliances
QGEN,Qiagen N.V. Common Shares ,$49.91,-0.44,-0.874%,11364507000.00,Netherlands,,535477,Health Care,Biotechnology: Biological Products (No Diagnostic Substances)
QS,QuantumScape Corporation Class A Common Stock,$8.14,0.25,3.169%,3548692813.00,United States,2020,5082317,Consumer Discretionary,Auto Parts:O.E.M.
QSR,Restaurant Brands International Inc. Common Shares,$67.40,-0.46,-0.678%,20617971388.00,Canada,2014,876727,,
QTWO,Q2 Holdings Inc. Common Stock,$31.92,0.46,1.462%,1835942257.00,,2014,227772,Technology,EDP Services
QUAD,Quad Graphics Inc Class A Common Stock,$4.48,0.05,1.129%,242747241.00,United States,,50717,Consumer Discretionary,Recreational Games/Products/Toys
QUOT,Quotient Technology Inc. Common Stock,$3.82,0.11,2.965%,369392296.00,,2014,538377,Consumer Discretionary,Advertising
QVCC,QVC Inc. 6.250% Senior Secured Notes due 2068,$14.90,-0.31,-2.038%,0.00,United States,2019,39047,,
QVCD,QVC Inc. 6.375% Senior Secured Notes due 2067,$14.67,-0.13,-0.878%,0.00,United States,2018,39671,,
R,Ryder System Inc. Common Stock,$92.48,-1.00,-1.07%,4647220988.00,United States,,103989,Consumer Discretionary,Rental/Leasing Companies
RA,Brookfield Real Assets Income Fund Inc. Common Stock,$17.39,0.07,0.404%,936679031.00,,2016,219150,Finance,Investment Managers
RAAS,Cloopen Group Holding Limited American Depositary Shares each representing two Class A Ordinary Shares,$0.9088,0.1117,14.013%,149379614.00,,2021,513820,Technology,Computer Software: Prepackaged Software
RACE,Ferrari N.V. Common Shares,$247.77,2.19,0.892%,45197413757.00,,2015,362523,Consumer Discretionary,Auto Manufacturing
RAD,Rite Aid Corporation Common Stock,$3.45,0.01,0.291%,195005571.00,United States,,2046761,Consumer Staples,Retail-Drug Stores and Proprietary Stores
RAMP,LiveRamp Holdings Inc. Common Stock,$25.90,0.64,2.534%,1721737646.00,United States,2018,448306,Technology,EDP Services
RBA,Ritchie Bros. Auctioneers Incorporated Common Stock,$58.66,0.43,0.738%,6504478435.00,Canada,,3366048,,
RBC,RBC Bearings Incorporated Common Stock,$243.50,9.62,4.113%,7065723751.00,United States,2022,161529,Industrials,Metal Fabrications
RBCP,RBC Bearings Incorporated 5.00% Series A Mandatory Convertible Preferred Stock,$114.55,1.5625,1.383%,0.00,United States,2022,31208,Industrials,Metal Fabrications
RBLX,Roblox Corporation Class A Common Stock,$35.97,0.27,0.756%,21611354793.00,United States,2021,9871609,Technology,EDP Services
RBOT,Vicarious Surgical Inc. Class A Common Stock,$2.66,-0.03,-1.115%,325503729.00,Hong Kong,2020,174434,Health Care,Medical Specialities
RBT,Rubicon Technologies Inc. Class A Common Stock,$1.97,0.12,6.486%,97937051.00,,2022,72331,Technology,EDP Services
RC,Ready Capital Corproation Common Stock,$12.97,0.01,0.077%,1433351924.00,United States,2013,580148,Real Estate,Real Estate Investment Trusts
RC^C,Ready Capital Corporation 6.25% Series C Cumulative Convertible Preferred Stock,$19.30,0.27,1.419%,,United States,,1101,,
RC^E,Ready Capital Corporation 6.50% Series E Cumulative Redeemable Preferred Stock,$19.80,0.44,2.273%,,United States,,53528,,
RCA,Ready Capital Corporation 7.00% Convertible Senior Notes due 2023,$25.40,0.03,0.118%,0.00,United States,2017,3543,Real Estate,Real Estate Investment Trusts
RCB,Ready Capital Corporation 6.20% Senior Notes due 2026,$23.38,0.08,0.343%,0.00,United States,2019,10883,,
RCC,Ready Capital Corporation 5.75% Senior Notes due 2026,$23.24,-0.1299,-0.556%,0.00,United States,2021,3278,Finance,Finance Companies
RCFA,RCF Acquisition Corp. Class A Ordinary Shares,$10.34,0.005,0.048%,297275000.00,,2021,187543,Finance,Business Services
RCI,Rogers Communication Inc. Common Stock,$49.06,-0.16,-0.325%,24771636101.00,Canada,,332553,,
RCL,D/B/A Royal Caribbean Cruises Ltd. Common Stock,$63.93,0.05,0.078%,16313786219.00,United States,1993,2550600,,
RCS,PIMCO Strategic Income Fund Inc.,$5.62,0.15,2.742%,252214360.00,United States,1994,92953,Finance,Investment Managers
RCUS,Arcus Biosciences Inc. Common Stock,$23.09,-0.06,-0.259%,1671893932.00,,2018,596239,Health Care,Biotechnology: Pharmaceutical Preparations
RDN,Radian Group Inc. Common Stock,$21.94,0.47,2.189%,3445137956.00,United States,,978089,Finance,Property-Casualty Insurers
RDW,Redwire Corporation Common Stock,$2.39,-0.03,-1.24%,152607929.00,United States,2021,72814,Industrials,Aerospace
RDY,Dr. Reddy's Laboratories Ltd Common Stock,$52.50,0.14,0.267%,8742491048.00,India,,88069,Health Care,Biotechnology: Pharmaceutical Preparations
RE,Everest Re Group Ltd. Common Stock,$357.05,6.21,1.77%,13983875390.00,Bermuda,,186509,Finance,Property-Casualty Insurers
RELX,RELX PLC PLC American Depositary Shares (Each representing One Ordinary Share),$29.41,0.15,0.513%,56232500642.00,United Kingdom,2015,768722,Consumer Discretionary,Business Services
RENN,Renren Inc. American Depositary Shares each representing fifteen Class A ordinary shares,$2.04,0.06,3.03%,50833399.00,China,2011,101218,Technology,EDP Services
RERE,ATRenew Inc. American Depositary Shares (every three of which representing two Class A ordinary shares),$3.12,0.08,2.632%,713552583.00,,2021,132135,Consumer Discretionary,Other Specialty Stores
RES,RPC Inc. Common Stock,$9.50,-0.10,-1.042%,2057995830.00,United States,,3292939,Energy,Oilfield Services/Equipment
REVG,REV Group Inc. Common Stock,$13.40,0.20,1.515%,801889487.00,United States,2017,96684,Industrials,Industrial Machinery/Components
REX,REX American Resources Corporation,$31.60,-0.69,-2.137%,549538820.00,United States,,108142,Industrials,Major Chemicals
REXR,Rexford Industrial Realty Inc. Common Stock,$62.01,0.79,1.29%,11378354609.00,United States,2013,824666,Real Estate,Real Estate Investment Trusts
REXR^B,Rexford Industrial Realty Inc. 5.875% Series B Cumulative Redeemable Preferred Stock,$24.55,-0.04,-0.163%,,United States,,4375,,
REXR^C,Rexford Industrial Realty Inc. 5.625% Series C Cumulative Redeemable Preferred Stock par value $0.01 per share,$24.00,-0.03,-0.125%,,United States,,10242,,
REZI,Resideo Technologies Inc. Common Stock ,$18.56,0.63,3.514%,2706862023.00,,2018,460973,Technology,Security Systems Services
RF,Regions Financial Corporation Common Stock,$23.20,0.30,1.31%,21679138059.00,United States,,5571235,Finance,Major Banks
RF^B,Regions Financial Corporation Depositary Shares Representing 1/40th Perpetual Preferred Series B,$26.09,0.00,0.00%,,United States,,63558,,
RF^C,Regions Financial Corporation Depositary Shares each Representing a 1/40th Interest in a  Share of 5.700% Fixed-to-Floating Rate Non-Cumulative  Perpetual Preferred Stock Series C,$25.40,-0.04,-0.157%,,United States,,57820,,
RF^E,Regions Financial Corporation Depositary Shares Each Representing a 1/40th Interest in a Share of 4.45% Non-Cumulative Perpetual Preferred Stock Series E,$19.80,0.1934,0.986%,,United States,,25585,,
RFI,Cohen & Steers Total Return Realty Fund Inc. Common Stock,$13.36,0.20,1.52%,352010536.00,United States,1993,39863,Finance,Investment Managers
RFL,Rafael Holdings Inc. Class B Common Stock,$2.06,0.02,0.98%,50413667.00,United States,2018,19810,Real Estate,Real Estate
RFM,RiverNorth Flexible Municipal Income Fund Inc. Common Stock,$16.37,-0.08,-0.486%,100097623.00,,2020,37661,Finance,Finance/Investors Services
RFMZ,RiverNorth Flexible Municipal Income Fund II Inc. Common Stock,$14.20,-0.07,-0.491%,345794935.00,,2021,86664,Finance,Trusts Except Educational Religious and Charitable
RFP,Resolute Forest Products Inc. Common Stock,$21.53,0.11,0.514%,1653758291.00,Canada,,527263,Basic Materials,Paper
RGA,Reinsurance Group of America Incorporated Common Stock,$151.92,3.05,2.049%,10153724968.00,United States,,444787,Finance,Life Insurance
RGR,Sturm Ruger & Company Inc. Common Stock,$55.46,0.13,0.235%,979785976.00,United States,,86965,,
RGS,Regis Corporation Common Stock,$1.63,0.02,1.242%,74224536.00,United States,1991,118204,,
RGT,Royce Global Value Trust Inc. Common Stock,$9.58,0.04,0.419%,60037314.00,,2013,13241,Finance,Trusts Except Educational Religious and Charitable
RH,RH Common Stock,$308.99,0.87,0.282%,7126611793.00,United States,2012,327891,Consumer Discretionary,Other Specialty Stores
RHI,Robert Half International Inc. Common Stock,$80.81,1.93,2.447%,8767766694.00,United States,,1395530,Consumer Discretionary,Diversified Commercial Services
RHP,Ryman Hospitality Properties Inc. (REIT),$89.86,1.27,1.434%,4956976295.00,United States,,273740,Real Estate,Real Estate Investment Trusts
RIG,Transocean Ltd (Switzerland) Common Stock,$6.66,0.24,3.738%,4807776924.00,Switzerland,,26853420,Energy,Oil & Gas Production
RIO,Rio Tinto Plc Common Stock,$80.40,0.52,0.651%,130316719890.00,Australia,2002,2907696,Basic Materials,Metal Mining
RITM,Rithm Capital Corp. Common Stock,$9.31,0.10,1.086%,4410287581.00,United States,,3049575,Real Estate,Real Estate Investment Trusts
RITM^A,Rithm Capital Corp. 7.50% Series A Fixed-to-Floating Rate Cumulative Redeemable Preferred Stock,$22.05,0.10,0.456%,,United States,,8433,,
RITM^B,Rithm Capital Corp. 7.125% Series B Fixed-to-Floating Rate Cumulative Redeemable Preferred Stock,$21.66,-0.002,-0.009%,,United States,,18126,,
RITM^C,Rithm Capital Corp. 6.375% Series C Fixed-to-Floating Rate Cumulative Redeemable Preferred Stock,$19.69,0.12,0.613%,,United States,,17283,,
RITM^D,Rithm Capital Corp. 7.00% Fixed-Rate Reset Series D Cumulative Redeemable Preferred Stock,$20.78,0.13,0.63%,,United States,,21550,,
RIV,RiverNorth Opportunities Fund Inc. Common Stock,$12.21,0.05,0.411%,223336077.00,,2015,78514,Finance,Finance Companies
RIV^A,RiverNorth Opportunities Fund Inc. 6.00% Series A Perpetual Preferred Stock,$23.81,0.04,0.168%,,,,24535,,
RJAC,Jackson Acquisition Company Class A Common Stock,$10.21,0.02,0.196%,283965625.00,,2022,179370,Industrials,Consumer Electronics/Appliances
RJF,Raymond James Financial Inc. Common Stock,$113.38,-4.73,-4.005%,24506093224.00,United States,,2722966,Finance,Investment Bankers/Brokers/Service
RJF^A,Raymond James Financial Inc. Depositary Shares each representing a 1/40th interest in a share of 6.75% Fixed-to-Floating Rate Series A Non-Cumulative Perpetual Preferred Stock,$25.35,0.05,0.198%,,United States,,325,,
RJF^B,Raymond James Financial Inc. Depositary Shares each representing a 1/40th interest in a share of 6.375% Fixed-to-Floating Rate Series B Non-Cumulative Perpetual Preferred Stock,$25.15,-0.09,-0.357%,,United States,,1513,,
RKT,Rocket Companies Inc. Class A Common Stock,$9.17,0.19,2.116%,1116709395.00,United States,2020,2023518,Finance,Finance: Consumer Services
RKTA,Rocket Internet Growth Opportunities Corp. Class A Ordinary Shares,$10.18,0.02,0.197%,339757500.00,,2021,599682,Finance,Business Services
RL,Ralph Lauren Corporation Common Stock,$124.21,0.23,0.186%,8194443107.00,United States,1997,829581,Consumer Discretionary,Apparel
RLI,RLI Corp. Common Stock (DE),$130.61,-2.42,-1.819%,5926842914.00,United States,,251144,Finance,Property-Casualty Insurers
RLJ,RLJ Lodging Trust Common Shares of Beneficial Interest $0.01 par value,$12.19,0.23,1.923%,1975437687.00,United States,2011,1492973,Real Estate,Real Estate Investment Trusts
RLJ^A,RLJ Lodging Trust $1.95 Series A Cumulative Convertible  Preferred Shares,$24.83,0.055,0.222%,,United States,,28064,,
RLTY,Cohen & Steers Real Estate Opportunities and Income Fund Common Shares of Beneficial Interest,$15.25,0.12,0.793%,0.00,,2022,96424,Finance,Investment Managers
RLX,RLX Technology Inc. American Depositary Shares each representing the right to receive one (1) Class A ordinary share,$2.68,0.07,2.682%,4148350627.00,,2021,5573926,Health Care, Medicinal Chemicals and Botanical Products 
RM,Regional Management Corp. Common Stock,$33.50,0.27,0.813%,321123697.00,United States,2012,7318,Finance,Finance: Consumer Services
RMAX,RE/MAX Holdings Inc. Class A Common Stock,$22.32,0.73,3.381%,407237730.00,,2013,85328,Finance,Real Estate
RMD,ResMed Inc. Common Stock,$232.17,1.01,0.437%,34009109021.00,United States,,537955,Health Care,Medical/Dental Instruments
RMI,RiverNorth Opportunistic Municipal Income Fund Inc. Common Stock,$18.35,0.06,0.328%,116949468.00,,2018,12650,Finance,Finance/Investors Services
RMM,RiverNorth Managed Duration Municipal Income Fund Inc. Common Stock,$15.66,-0.04,-0.255%,309122574.00,,2019,62656,Finance,Trusts Except Educational Religious and Charitable
RMMZ,RiverNorth Managed Duration Municipal Income Fund II Inc. Common Stock,$16.54,0.39,2.415%,139845700.00,,2022,10018,Finance,Investment Managers
RMPL^,RiverNorth Capital and Income Fund 5.875%% Series A Term Preferred Stock $0.0001 par value per share,$25.11,0.0005,0.002%,,,,256,,
RMT,Royce Micro-Cap Trust Inc. Common Stock,$9.40,0.02,0.213%,434929634.00,United States,,145634,Finance,Investment Managers
RNG,RingCentral Inc. Class A Common Stock,$38.42,0.90,2.399%,3689251224.00,,2013,987664,Technology,EDP Services
RNGR,Ranger Energy Services Inc. Class A Common Stock,$10.79,-0.47,-4.174%,268389662.00,United States,2017,41196,Energy,Oilfield Services/Equipment
