Symbol,Name,Last Sale,Net Change,% Change,Market Cap,Country,IPO Year,Volume,Sector,Industry
INFA,Informatica Inc. Class A Common Stock,$17.36,0.45,2.661%,4913628338.00,,2021,230152,Technology,EDP Services
INFY,Infosys Limited American Depositary Shares,$18.94,0.32,1.719%,78954697322.00,India,,6245471,Technology,EDP Services
ING,ING Group N.V. Common Stock,$14.23,0.26,1.861%,51667192927.00,Netherlands,1997,3623035,Finance,Commercial Banks
INGR,Ingredion Incorporated Common Stock,$102.66,0.15,0.146%,6729908843.00,United States,,306835,Consumer Staples,Farming/Seeds/Milling
INN,Summit Hotel Properties Inc. Common Stock,$8.28,0.11,1.346%,885098151.00,United States,2011,526647,Real Estate,Real Estate Investment Trusts
INN^E,Summit Hotel Properties Inc. 6.250% Series E Cumulative Redeemable Preferred Stock,$21.51,0.11,0.514%,,United States,,20437,,
INN^F,Summit Hotel Properties Inc. 5.875% Series F Cumulative Redeemable Preferred Stock $0.01 par value per share,$21.58,0.58,2.762%,,United States,,24705,,
INSI,Insight Select Income Fund,$16.08,0.04,0.249%,172271649.00,United States,,40293,Finance,Investment Managers
INSP,Inspire Medical Systems Inc. Common Stock,$254.25,4.46,1.785%,7345889649.00,United States,2018,247572,Health Care,Biotechnology: Electromedical & Electrotherapeutic Apparatus
INST,Instructure Holdings Inc. Common Stock,$26.57,0.47,1.801%,3786304391.00,,2021,71512,Technology,Computer Software: Prepackaged Software
INSW,International Seaways Inc. Common Stock ,$37.06,-0.91,-2.397%,1818846171.00,,2016,309225,Consumer Discretionary,Marine Transportation
INT,World Fuel Services Corporation Common Stock,$28.65,0.24,0.845%,1773981527.00,United States,,286410,Energy,Oil Refining/Marketing
INVH,Invitation Homes Inc. Common Stock,$32.12,0.04,0.125%,19638486277.00,United States,2017,2660333,Real Estate,Real Estate Investment Trusts
IONQ,IonQ Inc. Common Stock,$4.54,0.04,0.889%,907812993.00,United States,2021,3108499,Industrials,Wholesale Distributors
IOT,Samsara Inc. Class A Common Stock,$13.46,0.34,2.591%,6984068847.00,,2021,790166,Technology,Retail: Computer Software & Peripheral Equipment
IP,International Paper Company Common Stock,$37.23,0.91,2.506%,13241594435.00,United States,,2552906,Industrials,Containers/Packaging
IPG,Interpublic Group of Companies Inc. (The) Common Stock,$35.98,-0.33,-0.909%,13979119354.00,United States,,4016718,Consumer Discretionary,Advertising
IPI,Intrepid Potash Inc Common Stock,$32.58,0.68,2.132%,439469861.00,United States,2008,133931,Industrials,Major Chemicals
IPVF,InterPrivate III Financial Partners Inc. Class A Common Stock,$10.13,0.00,0.00%,336683213.00,,2021,15,Industrials,Consumer Electronics/Appliances
IQI,Invesco Quality Municipal Income Trust Common Stock,$10.18,-0.06,-0.586%,538357053.00,United States,,139541,Finance,Finance Companies
IQV,IQVIA Holdings Inc. Common Stock,$228.52,2.02,0.892%,42445310056.00,United States,2013,580369,Health Care,Managed Health Care
IR,Ingersoll Rand Inc. Common Stock,$55.53,-0.42,-0.751%,22485526509.00,United States,2017,3741494,Industrials,Industrial Machinery/Components
IRL,New Ireland Fund Inc (The) Common Stock,$10.50,0.06,0.575%,38083290.00,United States,1990,12763,Finance,Trusts Except Educational Religious and Charitable
IRM,Iron Mountain Incorporated (Delaware)Common Stock REIT,$53.63,1.09,2.075%,15590993804.00,United States,,1176614,Real Estate,Real Estate Investment Trusts
IRNT,IronNet Inc. Common Stock,$0.451,0.0334,7.998%,46772168.00,United States,2020,4613462,Technology,EDP Services
IRRX,Integrated Rail and Resources Acquisition Corp. Class A Common Stock,$10.34,0.00,0.00%,297275000.00,,2022,1500,Industrials,Consumer Electronics/Appliances
IRS,IRSA Inversiones Y Representaciones S.A. Common Stock,$6.35,0.19,3.084%,514918573.00,Argentina,,107180,Real Estate,Homebuilding
IRT,Independence Realty Trust Inc. Common Stock,$18.66,0.37,2.023%,4181228360.00,United States,2013,1306209,Real Estate,Real Estate Investment Trusts
ISD,PGIM High Yield Bond Fund Inc.,$12.94,0.12,0.936%,430342009.00,United States,2012,95275,Finance,Trusts Except Educational Religious and Charitable
IT,Gartner Inc. Common Stock,$328.92,0.32,0.097%,25992699070.00,United States,1993,416968,Finance,Diversified Commercial Services
ITCB,Itau CorpBanca American Depositary Shares (each representing 1500 shares of Common Stock no par value),$3.43,0.01,0.292%,2226110865.00,Chile,,1174,Finance,Commercial Banks
ITGR,Integer Holdings Corporation Common Stock,$71.84,0.45,0.63%,2380130537.00,United States,,91788,Health Care,Medical/Dental Instruments
ITT,ITT Inc. Common Stock ,$90.85,2.40,2.713%,7513295000.00,United States,2011,633068,Industrials,Fluid Controls
ITUB,Itau Unibanco Banco Holding SA American Depositary Shares (Each repstg 500 Preferred shares),$4.99,-0.03,-0.598%,48328911484.00,Brazil,,21392228,Finance,Commercial Banks
ITW,Illinois Tool Works Inc. Common Stock,$228.67,0.29,0.127%,70244309286.00,United States,,651048,Industrials,Industrial Machinery/Components
IVC,Invacare Corporation Common Stock,$0.62,0.0556,9.851%,23407688.00,United States,,110098,Health Care,Industrial Specialties
IVH,Delaware Ivy High Income Opportunities Fund,$11.88,0.07,0.593%,196854392.00,,2013,74885,Finance,Investment Managers
IVR,INVESCO MORTGAGE CAPITAL INC Common Stock,$14.38,0.26,1.841%,510490000.00,United States,2009,489700,Real Estate,Real Estate Investment Trusts
IVR^B,Invesco Mortgage Capital Inc. Preferred Series B Cum Fxd to Fltg,$22.1055,-0.0145,-0.066%,,United States,,10866,,
IVR^C,INVESCO MORTGAGE CAPITAL INC 7.5% Fixed-to-Floating Series C Cumulative Redeemable Preferred Stock Liquation Preference $25.00 per Share,$21.84,0.19,0.878%,,United States,,7043,,
IVT,InvenTrust Properties Corp. Common Stock,$24.73,0.12,0.488%,1667483831.00,,2021,94040,Real Estate,Real Estate Investment Trusts
IVZ,Invesco Ltd Common Stock,$18.47,0.47,2.611%,8399871710.00,United States,,9191496,Finance,Investment Managers
IX,Orix Corp Ads Common Stock,$87.47,0.12,0.137%,20555502045.00,Japan,,24896,Finance,Diversified Financial Services
J,Jacobs Solutions Inc. Common Stock,$122.72,0.82,0.673%,15537733950.00,,2022,628635,Industrials,Oilfield Services/Equipment
JATT,JATT Acquisition Corp Class A Ordinary Shares,$10.29,0.03,0.292%,177502500.00,,2021,10621,Health Care,Biotechnology: Biological Products (No Diagnostic Substances)
JBGS,JBG SMITH Properties Common Shares ,$19.45,0.11,0.569%,2213175316.00,United States,2017,1259871,Real Estate,Real Estate Investment Trusts
JBI,Janus International Group Inc. Common Stock,$10.79,0.13,1.22%,1582324097.00,,2021,262429,,
JBL,Jabil Inc. Common Stock,$78.28,-1.59,-1.991%,10432772010.00,United States,1993,1670968,Technology,Electrical Products
JBT,John Bean Technologies Corporation Common Stock,$106.98,2.74,2.629%,3408211418.00,United States,,191180,Industrials,Diversified Manufacture
JCE,Nuveen Core Equity Alpha Fund Nuveen Core Equity Alpha Fund Common Shares of Beneficial Interest,$12.84,0.10,0.785%,206235361.00,United States,2007,60833,Finance,Trusts Except Educational Religious and Charitable
JCI,Johnson Controls International plc Ordinary Share,$68.82,0.72,1.057%,47291286739.00,Switzerland,,3046851,Consumer Discretionary,Auto Parts:O.E.M.
JEF,Jefferies Financial Group Inc. Common Stock,$39.22,0.27,0.693%,8867642000.00,United States,,892526,Finance,Investment Bankers/Brokers/Service
JELD,JELD-WEN Holding Inc. Common Stock,$11.68,0.31,2.726%,985065002.00,United States,2017,347524,,
JEQ,abrdn Japan Equity Fund Inc. Common Stock,$5.72,0.02,0.351%,77253136.00,United States,1992,44143,Finance,Finance Companies
JFR,Nuveen Floating Rate Income Fund Common Stock,$8.47,0.09,1.074%,482099424.00,United States,2004,227781,Finance,Trusts Except Educational Religious and Charitable
JGH,Nuveen Global High Income Fund Common Shares of Beneficial Interest,$12.16,0.09,0.746%,281837099.00,United States,2014,30218,Finance,Investment Managers
JHAA,Nuveen Corporate Income 2023 Target Term Fund,$9.22,0.035,0.381%,72157029.00,,2018,3881,Finance,Finance/Investors Services
JHG,Janus Henderson Group plc Ordinary Shares,$25.65,-0.03,-0.117%,4249125263.00,,2017,2113117,Finance,Investment Managers
JHI,John Hancock Investors Trust Common Stock,$13.39,0.10,0.752%,117089484.00,United States,,17068,Finance,Trusts Except Educational Religious and Charitable
JHS,John Hancock Income Securities Trust Common Stock,$11.4018,-0.0382,-0.334%,132792033.00,United States,,26745,Finance,Finance Companies
JHX,James Hardie Industries plc American Depositary Shares (Ireland),$22.57,0.26,1.165%,10026641293.00,Ireland,,46665,Industrials,Building Materials
JILL,J. Jill Inc. Common Stock,$25.40,-0.13,-0.509%,257859225.00,,2017,62513,Consumer Discretionary,Clothing/Shoe/Accessory Stores
JKS,JinkoSolar Holding Company Limited American Depositary Shares (each representing 4 Common Shares),$56.55,-0.59,-1.033%,2834484377.00,China,2010,479803,Technology,Semiconductors
JLL,Jones Lang LaSalle Incorporated Common Stock,$181.94,4.27,2.403%,8635338894.00,United States,,203026,Finance,Real Estate
JLS,Nuveen Mortgage and Income Fund,$16.65,0.03,0.181%,91365876.00,United States,2009,15188,Finance,Investment Managers
JMIA,Jumia Technologies AG American Depositary Shares each representing two Ordinary Shares,$4.06,0.12,3.046%,405500868.00,,2019,2756437,Consumer Discretionary,Catalog/Specialty Distribution
JMM,Nuveen Multi-Market Income Fund (MA),$6.04,-0.04,-0.658%,57152594.00,United States,,32522,Finance,Trusts Except Educational Religious and Charitable
JNJ,Johnson & Johnson Common Stock,$168.89,-0.62,-0.366%,441560136386.00,United States,,6945583,Health Care,Biotechnology: Pharmaceutical Preparations
JNPR,Juniper Networks Inc. Common Stock,$32.32,0.34,1.063%,10489634503.00,United States,1999,1931901,Technology,Computer peripheral equipment
JOBY,Joby Aviation Inc. Common Stock,$4.12,-0.01,-0.242%,2561533277.00,United States,2020,2375172,Consumer Discretionary,Aerospace
JOE,St. Joe Company (The) Common Stock,$45.59,0.78,1.741%,2659517314.00,United States,,101815,Real Estate,Homebuilding
JOF,Japan Smaller Capitalization Fund Inc Common Stock,$6.93,-0.04,-0.574%,196353878.00,United States,1990,12584,Finance,Trusts Except Educational Religious and Charitable
JPC,Nuveen Preferred & Income Opportunities Fund,$7.72,0.05,0.652%,811134471.00,United States,2003,219376,Finance,Investment Managers
JPI,Nuveen Preferred and Income Term Fund Common Shares of Beneficial Interest,$19.87,0.01,0.05%,452487966.00,,2012,40087,Finance,Finance Companies
JPM,JP Morgan Chase & Co. Common Stock,$139.98,0.86,0.618%,410743314000.00,United States,,7485976,Finance,Major Banks
JPM^C,J P Morgan Chase & Co Depositary Shares each representing a 1/400th interest in a share of 6.00% Non-Cumulative  Preferred Stock Series EE,$25.71,0.12,0.469%,,United States,,136225,,
JPM^D,J P Morgan Chase & Co Depositary Shares each representing a 1/400th  interest in a share of 5.75% Non-Cumulative  Preferred Stock Series DD,$25.10,0.11,0.44%,,United States,,149632,,
JPM^J,J P Morgan Chase & Co Depositary Shares each representing a 1/400th interest in a share of JPMorgan Chase & Co. 4.75% Non-Cumulative Preferred Stock Series GG,$22.25,0.07,0.316%,,United States,,85988,,
JPM^K,J P Morgan Chase & Co Depositary Shares each representing a 1/400th interest in a share of 4.55% Non-Cumulative Preferred Stock Series JJ,$21.20,-0.04,-0.188%,,United States,,303512,,
JPM^L,J P Morgan Chase & Co Depositary Shares each representing a 1/400th interest in a share of 4.625% Non-Cumulative Preferred Stock Series LL,$21.4799,-0.0201,-0.093%,,United States,,183375,,
JPM^M,J P Morgan Chase & Co Depositary Shares each representing a 1/400th interest in a share of 4.20% Non-Cumulative Preferred Stock Series MM,$19.80,-0.07,-0.352%,,United States,,307896,,
JPS,Nuveen Preferred & Income Securities Fund,$7.45,0.07,0.949%,1532546443.00,United States,2002,252357,Finance,Investment Managers
JPT,Nuveen Preferred and Income Fund Common Shares of Beneficial Interest,$19.12,0.05,0.262%,83967851.00,United States,2017,6717,Finance,Trusts Except Educational Religious and Charitable
JQC,Nuveen Credit Strategies Income Fund Shares of Beneficial Interest,$5.31,0.00,0.00%,720085330.00,United States,2003,445083,Finance,Finance Companies
JRI,Nuveen Real Asset Income and Growth Fund Common Shares of Beneficial Interest,$12.76,0.01,0.078%,350308957.00,United States,2012,48827,Finance,Finance Companies
JRO,Nuveen Floating Rate Income Opportuntiy Fund Shares of Beneficial Interest,$8.37,0.02,0.24%,339329995.00,United States,2004,138046,Finance,Investment Managers
JRS,Nuveen Real Estate Income Fund Common Shares of Beneficial Interest,$8.46,0.06,0.714%,244430305.00,United States,2001,61028,Finance,Finance/Investors Services
JSD,Nuveen Short Duration Credit Opportunities Fund Common Shares of Beneficial Interest,$12.22,0.04,0.328%,123246619.00,United States,2011,17860,Finance,Finance Companies
JT,Jianpu Technology Inc. American depositary shares,$1.91,0.15,8.523%,40461199.00,,2017,161261,Technology,EDP Services
JUN,Juniper II Corp. Class A Common Stock,$10.29,0.00,0.00%,384588750.00,,2021,756170,Industrials,Consumer Electronics/Appliances
JWN,Nordstrom Inc. Common Stock,$18.43,0.00,0.00%,2950298783.00,United States,,4728566,Consumer Discretionary,Clothing/Shoe/Accessory Stores
JWSM,Jaws Mustang Acquisition Corp. Class A Ordinary Shares,$10.15,0.01,0.099%,1313156250.00,,2021,382126,Finance,Business Services
JXN,Jackson Financial Inc. Class A Common Stock ,$43.47,1.23,2.912%,3609617260.00,,2021,1164804,Finance,Life Insurance
K,Kellogg Company Common Stock,$67.52,-0.50,-0.735%,23043302910.00,United States,,1449636,Consumer Staples,Packaged Foods
KAI,Kadant Inc Common Stock,$200.61,2.20,1.109%,2339834997.00,United States,1992,48197,Technology,Industrial Machinery/Components
KAMN,Kaman Corporation Common Stock,$23.89,0.12,0.505%,669371402.00,United States,,95706,Industrials,Military/Government/Technical
KAR,KAR Auction Services Inc Common Stock,$14.32,-0.21,-1.445%,1559560326.00,United States,2009,564505,,
KB,KB Financial Group Inc,$48.28,0.66,1.386%,18644717727.00,South Korea,,98928,Finance,Commercial Banks
KBH,KB Home Common Stock,$37.40,0.40,1.081%,3141240923.00,United States,1986,1231726,,
KBR,KBR Inc. Common Stock,$50.84,0.48,0.953%,6975055774.00,United States,2006,690602,Industrials,Oilfield Services/Equipment
KCGI,Kensington Capital Acquisition Corp. V Class A Ordinary Shares,$10.2784,0.0084,0.082%,354604800.00,,2021,105453,Finance,Business Services
KD,Kyndryl Holdings Inc. Common Stock,$13.02,0.16,1.244%,2952806620.00,,2021,1497487,Technology,EDP Services
KEN,Kenon Holdings Ltd. Ordinary Shares,$31.36,-0.90,-2.79%,1689815913.00,Singapore,2015,33056,Utilities,Electric Utilities: Central
KEP,Korea Electric Power Corporation Common Stock,$8.27,0.00,0.00%,10618085834.00,South Korea,1994,54446,Utilities,Electric Utilities: Central
KEX,Kirby Corporation Common Stock,$65.12,0.16,0.246%,3900688000.00,United States,,342857,Consumer Discretionary,Marine Transportation
KEY,KeyCorp Common Stock,$18.73,0.40,2.182%,17481177250.00,United States,,14184150,Finance,Major Banks
KEY^I,KeyCorp Depositary Shares Each Representing a 1/40th Ownership Interest in a Share of Fixed-to-Floating Rate Perpetual Non-Cumulative Preferred Stock Series E,$25.84,0.18,0.701%,,United States,,31417,,
KEY^J,KeyCorp Depositary Shares each representing a 1/40th ownership interest in a share of Fixed Rate Perpetual Non-Cumulative Preferred Stock Series F,$24.09,0.14,0.585%,,United States,,31139,,
KEY^K,KeyCorp Depositary Shares each representing a 1/40th ownership interest in a share of Fixed Rate Perpetual Non-Cumulative Preferred Stock Series G,$24.30,-0.04,-0.164%,,United States,,28976,,
KEY^L,KeyCorp Depositary Shares each representing a 1/40th ownership interest in a share of Fixed Rate Perpetual Non-Cumulative Preferred Stock Series H,$25.24,0.03,0.119%,,United States,,31668,,
KEYS,Keysight Technologies Inc. Common Stock,$180.06,-0.79,-0.437%,32112637566.00,United States,2014,1051566,Industrials,Industrial Machinery/Components
KF,Korea Fund Inc. (The) New Common Stock,$24.42,0.42,1.75%,122185617.00,United States,,6168,Finance,Investment Managers
KFS,Kingsway Financial Services Inc. Common Stock (DE),$8.06,-0.01,-0.124%,195250405.00,Canada,,5109,,
KFY,Korn Ferry Common Stock,$55.43,0.56,1.021%,2921712529.00,United States,1999,184928,Consumer Discretionary,Diversified Commercial Services
KGC,Kinross Gold Corporation Common Stock,$4.85,-0.03,-0.615%,6234222873.00,Canada,2001,10676807,,
KIM,Kimco Realty Corporation (HC) Common Stock,$22.12,0.03,0.136%,13680856458.00,United States,,2518891,Real Estate,Real Estate Investment Trusts
KIM^L,Kimco Realty Corporation Class L Depositary Shares each of which represents a one-one thousandth fractional interest in a share of 5.125% Class L Cumulative Redeemable Preferred Stock liquidation preference $25000.00 per share,$23.37,0.38,1.653%,,United States,,9147,,
KIM^M,Kimco Realty Corporation Class M Depositary Shares each of which represents a one-one thousandth fractional interest in a share of 5.25% Class M Cumulative Redeemable Preferred Stock liquidation preference $25000.00 per share,$23.39,0.29,1.255%,,United States,,11532,,
KIND,Nextdoor Holdings Inc. Class A Common Stock,$2.17,0.07,3.333%,802411006.00,United States,,989932,Consumer Discretionary,EDP Services
KIO,KKR Income Opportunities Fund Common Shares,$11.61,0.02,0.173%,236151057.00,,2013,319098,Finance,Investment Managers
KKR,KKR & Co. Inc. Common Stock,$55.32,1.75,3.267%,47636708261.00,United States,,2710941,Finance,Investment Managers
KKR^C,KKR & Co. Inc. 6.00% Series C Mandatory Convertible Preferred Stock,$66.7979,2.0529,3.171%,,United States,,53873,,
KKRS,KKR Group Finance Co. IX LLC 4.625% Subordinated Notes due 2061,$19.44,0.06,0.31%,0.00,,2021,32447,,
KLR,Kaleyra Inc. Common Stock,$1.13,0.03,2.727%,51255710.00,United States,2018,114928,Technology,Retail: Computer Software & Peripheral Equipment
KMB,Kimberly-Clark Corporation Common Stock,$130.27,-1.79,-1.355%,43965095085.00,United States,,2775345,Consumer Discretionary,Paper
KMF,Kayne Anderson NextGen Energy & Infrastructure Inc.,$7.90,0.07,0.894%,372859950.00,,2010,91806,Finance,Investment Managers
KMI,Kinder Morgan Inc. Common Stock,$18.61,0.16,0.867%,41830479941.00,United States,2011,14295102,Utilities,Natural Gas Distribution
KMPB,Kemper Corporation 5.875% Fixed-Rate Reset Junior Subordinated Debentures due 2062,$22.29,0.16,0.723%,0.00,United States,2022,11621,Finance,Life Insurance
KMPR,Kemper Corporation,$55.03,-1.32,-2.343%,3515599364.00,United States,,573039,Finance,Property-Casualty Insurers
KMT,Kennametal Inc. Common Stock,$27.63,0.11,0.40%,2226325573.00,United States,,482176,Industrials,Industrial Machinery/Components
KMX,CarMax Inc,$66.26,-0.05,-0.075%,10470637044.00,United States,,1665632,Consumer Discretionary,Other Specialty Stores
KN,Knowles Corporation Common Stock,$19.17,0.35,1.86%,1743443389.00,,2014,595060,Telecommunications,Telecommunications Equipment
KNOP,KNOT Offshore Partners LP Common Units representing Limited Partner Interests,$5.68,-0.02,-0.351%,192898173.00,United Kingdom,2013,252110,Consumer Discretionary,Marine Transportation
KNSL,Kinsale Capital Group Inc. Common Stock,$272.27,1.73,0.639%,6284055583.00,United States,,73864,Finance,Property-Casualty Insurers
KNSW,KnightSwan Acquisition Corporation Class A Common Stock,$10.26,0.00,0.00%,294975000.00,,2022,1,Industrials,Consumer Electronics/Appliances
KNTK,Kinetik Holdings Inc. Class A Common Stock,$31.98,0.09,0.282%,4317151101.00,United States,2022,133803,Energy,Oil & Gas Production
KNX,Knight-Swift Transportation Holdings Inc.,$57.74,0.35,0.61%,9278587040.00,United States,2017,2621558,Industrials,Trucking Freight/Courier Services
KO,Coca-Cola Company (The) Common Stock,$60.81,-0.12,-0.197%,262973651584.00,United States,,11883771,Consumer Staples,Beverages (Production/Distribution)
KODK,Eastman Kodak Company Common New,$3.41,-0.01,-0.292%,269737056.00,United States,,767242,Consumer Discretionary,Business Services
KOF,Coca Cola Femsa S.A.B. de C.V.  American Depositary Shares each representing 10 Units (each Unit consists of 3 Series B Shares and 5 Series L Shares),$75.90,0.92,1.227%,15945316853.00,Mexico,1993,191444,Consumer Staples,Beverages (Production/Distribution)
KOP,Koppers Holdings Inc. Koppers Holdings Inc. Common Stock,$32.69,-0.22,-0.668%,683155783.00,United States,2006,47382,Industrials,Industrial Specialties
KORE,KORE Group Holdings Inc. Common Stock,$2.23,0.10,4.695%,170126122.00,,,59175,Consumer Discretionary,Telecommunications Equipment
KOS,Kosmos Energy Ltd. Common Shares (DE),$8.15,0.33,4.22%,3715532033.00,Bermuda,2011,6036618,Energy,Oil & Gas Production
KR,Kroger Company (The) Common Stock,$44.46,-0.44,-0.98%,31825440563.00,United States,,3105524,Consumer Staples,Food Chains
KRC,Kilroy Realty Corporation Common Stock,$39.13,0.07,0.179%,4573414736.00,United States,1997,558040,Real Estate,Real Estate Investment Trusts
KREF,KKR Real Estate Finance Trust Inc. Common Stock,$15.44,0.04,0.26%,1066826970.00,United States,2017,188919,Real Estate,Real Estate Investment Trusts
KREF^A,KKR Real Estate Finance Trust Inc. 6.50% Series A Cumulative Redeemable Preferred Stock,$19.00,0.35,1.877%,,United States,,35274,,
KRG,Kite Realty Group Trust Common Stock,$21.03,0.04,0.191%,4607650014.00,United States,2004,1269241,Real Estate,Real Estate Investment Trusts
KRO,Kronos Worldwide Inc Common Stock,$11.36,0.36,3.273%,1311739507.00,United States,,187172,Industrials,Major Chemicals
KRP,Kimbell Royalty Partners Common Units Representing Limited Partner Interests,$16.75,0.36,2.196%,1006376147.00,United States,2017,356216,Energy,Oil & Gas Production
KSM,DWS Strategic Municipal Income Trust,$8.76,0.01,0.114%,98146523.00,United States,1989,52342,Finance,Trusts Except Educational Religious and Charitable
KSS,Kohl's Corporation Common Stock,$31.99,0.22,0.692%,3534387255.00,United States,1992,2469549,Consumer Discretionary,Department/Specialty Retail Stores
KT,KT Corporation Common Stock,$14.49,-0.11,-0.753%,7420116808.00,South Korea,,624805,Telecommunications,Telecommunications Equipment
KTB,Kontoor Brands Inc. Common Stock ,$47.10,0.95,2.059%,2612431597.00,,2019,262316,,
KTF,DWS Municipal Income Trust,$8.92,-0.06,-0.668%,352348367.00,United States,1988,220510,Finance,Finance Companies
KTH,Structures Products Cp 8% CorTS Issued by Peco Energy Cap Tr II Preferred Stock,$29.40,0.3143,1.081%,0.00,United States,,2459,Finance,Investment Managers
KTN,Structured Products Corp 8.205% CorTS 8.205% Corporate Backed Trust Securities (CorTS),$27.70,0.0898,0.325%,0.00,United States,,730,,
KUKE,Kuke Music Holding Limited American Depositary Shares each representing one Ordinary Share,$0.49,-0.01,-2.00%,14487694.00,,2021,3340,Real Estate,Other Consumer Services
KW,Kennedy-Wilson Holdings Inc. Common Stock,$17.36,-0.04,-0.23%,2392047732.00,United States,,336637,Real Estate,Real Estate
KWR,Quaker Houghton Common Stock,$187.00,0.39,0.209%,3353221168.00,United States,,77213,Industrials,Automotive Aftermarket
KYN,Kayne Anderson Energy Infrastructure Fund Inc.,$9.20,0.06,0.656%,1252410076.00,United States,2004,372397,Finance,Finance/Investors Services
L,Loews Corporation Common Stock,$61.15,0.56,0.924%,14518664230.00,United States,,504683,Finance,Property-Casualty Insurers
LAC,Lithium Americas Corp. Common Shares,$22.10,-0.17,-0.763%,2983500000.00,Canada,,2133962,,
LAD,Lithia Motors Inc. Common Stock,$242.77,6.20,2.621%,6636946038.00,United States,,192269,Consumer Discretionary,Other Specialty Stores
LADR,Ladder Capital Corp Class A Common Stock,$11.00,0.03,0.273%,1392207839.00,,2014,367097,Real Estate,Real Estate Investment Trusts
LANV,Lanvin Group Holdings Limited Ordinary Shares,$7.00,0.51,7.858%,916797490.00,,2022,226782,,
LAW,CS Disco Inc. Common Stock,$7.22,-0.16,-2.168%,426252591.00,United States,2021,242615,Technology,Computer Software: Prepackaged Software
LAZ,Lazard LTD. Lazard LTD. Class A Common Stock,$40.69,0.78,1.954%,3495897585.00,Bermuda,2005,483741,Finance,Investment Managers
LBRT,Liberty Energy Inc. Class A common stock,$15.13,-0.02,-0.132%,2756062947.00,United States,2018,7090846,Energy,Oilfield Services/Equipment
LC,LendingClub Corporation Common Stock,$9.17,-1.17,-11.315%,963663342.00,United States,2014,9275063,Finance,Finance Companies
LCI,Lannett Co Inc Common Stock,$0.54,-0.08,-12.903%,22654344.00,United States,,771915,Health Care,Biotechnology: Pharmaceutical Preparations
LCII,LCI Industries,$106.71,0.46,0.433%,2713666566.00,United States,1995,167555,Consumer Discretionary,Auto Parts:O.E.M.
LCW,Learn CW Investment Corporation Class A Ordinary Shares,$10.22,0.04,0.393%,293825000.00,,2021,5000,Finance,Business Services
LDI,loanDepot Inc. Class A Common Stock,$2.34,0.10,4.464%,397600791.00,,2021,398416,Finance,Finance: Consumer Services
LDOS,Leidos Holdings Inc. Common Stock,$97.78,-0.37,-0.377%,13365504883.00,United States,,583656,Technology,EDP Services
LDP,Cohen & Steers Limited Duration Preferred and Income Fund Inc.,$20.61,0.09,0.439%,599322745.00,United States,2012,82422,Finance,Finance Companies
LEA,Lear Corporation Common Stock,$136.25,1.53,1.136%,8053148083.00,United States,,468294,Consumer Discretionary,Auto Parts:O.E.M.
LEG,Leggett & Platt Incorporated Common Stock,$35.32,0.33,0.943%,4682633662.00,United States,,676500,Consumer Discretionary,Home Furnishings
LEJU,Leju Holdings Limited American Depositary Shares each representing one Ordinary share,$1.40,-0.05,-3.448%,19204164.00,,2014,2962,Finance,Real Estate
LEN,Lennar Corporation Class A Common Stock,$100.02,0.98,0.989%,29122481932.00,United States,,1382257,Real Estate,Building operators
